location,query,has_ai_overview,all_items,cited_sources,all_references,paa_questions
Nigeria,gestational diabetes symptoms,True,"['Increased Thirst: A feeling of dehydration, needing to drink more water than normal.', 'Frequent Urination: Needing to use the bathroom more often, as the kidneys work harder to remove excess glucose.', 'Fatigue: Feeling unusually tired or lacking energy.', 'Blurred Vision: Temporary vision changes caused by high blood sugar.', 'Increased Hunger: Feeling hungry even after eating.', 'Recurring Infections: Such as vaginal or bladder infections, often due to high glucose.', 'High Birth Weight: Babies may grow too large, causing potential delivery complications.', 'Preterm Birth: Labor occurring before 37 weeks.', 'Low Blood Sugar in Baby: Babies may develop low blood sugar immediately after birth.', 'Preeclampsia: High blood pressure during pregnancy.']","[{'title': 'Gestational Diabetes: Causes, Symptoms & Treatment', 'link': 'https://my.clevelandclinic.org/health/diseases/9012-gestational-diabetes', 'source': 'Cleveland Clinic'}, {'title': 'Overview: Gestational diabetes - InformedHealth.org - NCBI Bookshelf', 'link': 'https://www.ncbi.nlm.nih.gov/books/NBK293712/', 'source': 'National Institutes of Health (.gov)'}, {'title': 'Gestational Diabetes', 'link': 'https://idf.org/about-diabetes/types-of-diabetes/gestational-diabetes/', 'source': 'International Diabetes Federation'}, {'title': 'Gestational diabetes: MedlinePlus Medical Encyclopedia', 'link': 'https://medlineplus.gov/ency/article/000896.htm', 'source': 'MedlinePlus (.gov)'}, {'title': 'Gestational Diabetes - NIDDK', 'link': 'https://www.niddk.nih.gov/health-information/diabetes/overview/what-is-diabetes/gestational', 'source': 'National Institutes of Health (.gov)'}, {'title': ""Symptoms of gestational diabetes - Tommy's"", 'link': 'https://www.tommys.org/pregnancy-information/pregnancy-complications/gestational-diabetes/symptoms-gestational-diabetes', 'source': ""Tommy's | The pregnancy and baby charity""}, {'title': 'What Are the Signs and Symptoms of Gestational Diabetes?', 'link': 'https://int.livhospital.com/what-are-the-signs-and-symptoms-of-gestational-diabetes/', 'source': 'Liv Hospital'}, {'title': 'Gestational Diabetes Symptoms & Warning Signs in Pregnancy', 'link': 'https://www.youtube.com/watch?v=6Oekb9Ce-EA', 'source': 'YouTube'}, {'title': 'Gestational diabetes - Symptoms & causes - Mayo Clinic', 'link': 'https://www.mayoclinic.org/diseases-conditions/gestational-diabetes/symptoms-causes/syc-20355339', 'source': 'Mayo Clinic'}, {'title': 'What Are the Signs of Gestational Diabetes During Pregnancy?', 'link': 'https://www.drrodriguezortiz.com/post/what-are-the-signs-of-gestational-diabetes-during-pregnancy', 'source': 'Carlos Rodriguez Ortiz MD, PA'}, {'title': 'Gestational diabetes - NHS', 'link': 'https://www.nhs.uk/conditions/gestational-diabetes/', 'source': 'nhs.uk'}]","[{'title': 'Gestational Diabetes: Causes, Symptoms & Treatment', 'link': 'https://my.clevelandclinic.org/health/diseases/9012-gestational-diabetes', 'source': 'Cleveland Clinic'}, {'title': 'Gestational diabetes - Symptoms & causes - Mayo Clinic', 'link': 'https://www.mayoclinic.org/diseases-conditions/gestational-diabetes/symptoms-causes/syc-20355339', 'source': 'Mayo Clinic'}, {'title': 'Gestational diabetes - NHS', 'link': 'https://www.nhs.uk/conditions/gestational-diabetes/', 'source': 'nhs.uk'}, {'title': 'Gestational Diabetes', 'link': 'https://idf.org/about-diabetes/types-of-diabetes/gestational-diabetes/', 'source': 'International Diabetes Federation'}, {'title': 'Gestational Diabetes - NIDDK', 'link': 'https://www.niddk.nih.gov/health-information/diabetes/overview/what-is-diabetes/gestational', 'source': 'National Institutes of Health (.gov)'}, {'title': ""Symptoms of gestational diabetes - Tommy's"", 'link': 'https://www.tommys.org/pregnancy-information/pregnancy-complications/gestational-diabetes/symptoms-gestational-diabetes', 'source': ""Tommy's | The pregnancy and baby charity""}, {'title': 'Overview: Gestational diabetes - InformedHealth.org - NCBI Bookshelf', 'link': 'https://www.ncbi.nlm.nih.gov/books/NBK293712/', 'source': 'National Institutes of Health (.gov)'}, {'title': 'Gestational diabetes: MedlinePlus Medical Encyclopedia', 'link': 'https://medlineplus.gov/ency/article/000896.htm', 'source': 'MedlinePlus (.gov)'}, {'title': 'What Are the Signs of Gestational Diabetes During Pregnancy?', 'link': 'https://www.drrodriguezortiz.com/post/what-are-the-signs-of-gestational-diabetes-during-pregnancy', 'source': 'Carlos Rodriguez Ortiz MD, PA'}, {'title': 'What Are the Signs and Symptoms of Gestational Diabetes?', 'link': 'https://int.livhospital.com/what-are-the-signs-and-symptoms-of-gestational-diabetes/', 'source': 'Liv Hospital'}, {'title': 'Gestational Diabetes Symptoms & Warning Signs in Pregnancy', 'link': 'https://www.youtube.com/watch?v=6Oekb9Ce-EA', 'source': 'YouTube'}]","['How do you know if you have gestational diabetes?', 'How does gestational diabetes affect the baby after birth?', 'How long does gestational diabetes last?', 'Can I have a healthy baby with gestational diabetes?']"
Nigeria,signs of preeclampsia,True,"['High Blood Pressure: Often detected at prenatal visits.', 'Severe Headache: A new headache that does not go away with medication.', 'Vision Changes: Blurry vision, seeing spots, flashing lights, or sensitivity to light.', 'Upper Abdominal Pain: Severe pain under the ribs, usually on the right side, sometimes mistaken for heartburn or gallbladder issues.', 'Sudden Swelling (Edema): Rapid swelling of the face, hands, or feet.', 'Rapid Weight Gain: Often caused by fluid retention.', 'Shortness of Breath: Caused by fluid in the lungs.', 'Nausea or Vomiting: Occurring suddenly in the second half of pregnancy.', 'Reduced Urine Output: Urinating less frequently.', 'Severe nausea/vomiting.', 'Sudden weight gain (>2–5 pounds in a week).', 'Severe pain in the upper right belly or shoulder.', 'Mental status changes, such as confusion or agitation.']","[{'title': 'Preeclampsia - Symptoms & causes - Mayo Clinic', 'link': 'https://www.mayoclinic.org/diseases-conditions/preeclampsia/symptoms-causes/syc-20355745', 'source': 'Mayo Clinic'}, {'title': 'Preeclampsia: Toxemia, Causes, Symptoms & Risk Factors', 'link': 'https://my.clevelandclinic.org/health/diseases/17952-preeclampsia', 'source': 'Cleveland Clinic'}, {'title': 'Pre-eclampsia - World Health Organization (WHO)', 'link': 'https://www.who.int/news-room/fact-sheets/detail/pre-eclampsia', 'source': 'World Health Organization (WHO)'}, {'title': 'Preeclampsia - March of Dimes', 'link': 'https://www.marchofdimes.org/find-support/topics/pregnancy/preeclampsia', 'source': 'March of Dimes'}, {'title': 'What Are the Causes and Symptoms of Preeclampsia? - Healthline', 'link': 'https://www.healthline.com/health/preeclampsia', 'source': 'Healthline'}, {'title': 'Preeclampsia: Causes, symptoms, and treatments', 'link': 'https://www.medicalnewstoday.com/articles/252025', 'source': 'Medical News Today'}, {'title': ""Pre-Eclampsia: Symptoms, Treatment and Prevention | Tommy's"", 'link': 'https://www.tommys.org/pregnancy-information/pregnancy-complications/pre-eclampsia-information-and-support', 'source': ""Tommy's | The pregnancy and baby charity""}, {'title': 'Preeclampsia - StatPearls - NCBI Bookshelf - NIH', 'link': 'https://www.ncbi.nlm.nih.gov/books/NBK570611/', 'source': 'National Institutes of Health (.gov)'}, {'title': 'Signs And Symptoms Of Preeclampsia', 'link': 'https://www.preeclampsia.org/signs-and-symptoms', 'source': 'Preeclampsia Foundation'}, {'title': 'Preeclampsia: Signs & Symptoms You Have To Watch Out For', 'link': 'https://www.youtube.com/watch?v=edgH2KueUXc&t=8', 'source': 'YouTube'}, {'title': 'Maternal Early Warning Signs - Preeclampsia Foundation', 'link': 'https://www.preeclampsia.org/the-news/Awareness/maternal-early-warning-signs-preeclampsia', 'source': 'Preeclampsia Foundation'}]","[{'title': 'Preeclampsia - Symptoms & causes - Mayo Clinic', 'link': 'https://www.mayoclinic.org/diseases-conditions/preeclampsia/symptoms-causes/syc-20355745', 'source': 'Mayo Clinic'}, {'title': 'Preeclampsia: Toxemia, Causes, Symptoms & Risk Factors', 'link': 'https://my.clevelandclinic.org/health/diseases/17952-preeclampsia', 'source': 'Cleveland Clinic'}, {'title': 'Signs And Symptoms Of Preeclampsia', 'link': 'https://www.preeclampsia.org/signs-and-symptoms', 'source': 'Preeclampsia Foundation'}, {'title': 'What Are the Causes and Symptoms of Preeclampsia? - Healthline', 'link': 'https://www.healthline.com/health/preeclampsia', 'source': 'Healthline'}, {'title': 'Preeclampsia - March of Dimes', 'link': 'https://www.marchofdimes.org/find-support/topics/pregnancy/preeclampsia', 'source': 'March of Dimes'}, {'title': 'Pre-eclampsia - World Health Organization (WHO)', 'link': 'https://www.who.int/news-room/fact-sheets/detail/pre-eclampsia', 'source': 'World Health Organization (WHO)'}, {'title': ""Pre-Eclampsia: Symptoms, Treatment and Prevention | Tommy's"", 'link': 'https://www.tommys.org/pregnancy-information/pregnancy-complications/pre-eclampsia-information-and-support', 'source': ""Tommy's | The pregnancy and baby charity""}, {'title': 'Preeclampsia - StatPearls - NCBI Bookshelf - NIH', 'link': 'https://www.ncbi.nlm.nih.gov/books/NBK570611/', 'source': 'National Institutes of Health (.gov)'}, {'title': 'Preeclampsia: Causes, symptoms, and treatments', 'link': 'https://www.medicalnewstoday.com/articles/252025', 'source': 'Medical News Today'}, {'title': 'Maternal Early Warning Signs - Preeclampsia Foundation', 'link': 'https://www.preeclampsia.org/the-news/Awareness/maternal-early-warning-signs-preeclampsia', 'source': 'Preeclampsia Foundation'}, {'title': 'Preeclampsia: Signs & Symptoms You Have To Watch Out For', 'link': 'https://www.youtube.com/watch?v=edgH2KueUXc&t=8', 'source': 'YouTube'}]","['What are the three early signs of preeclampsia?', 'What happens if you have preeclampsia during pregnancy?', 'How to tell if you have preeclampsia at home?', 'How to avoid preeclampsia during pregnancy?']"
Nigeria,what is a C-section,True,"['Labor stalls: The labor process is slow or obstructed (dystocia).', 'Fetal distress: The baby is not receiving enough oxygen or has an abnormal heart rate.', ""Baby's position: The baby is in a breech (feet down) or shoulder position."", 'Placenta issues: The placenta covers the cervix (placenta previa) or detaches.', 'Multiple pregnancies: Carrying twins, triplets, or more.', 'Health conditions: The mother has active herpes, high blood pressure, or a previous C-section.', 'Anesthesia: Most women are awake, receiving spinal or epidural anesthesia to numb the lower body. General anesthesia (being asleep) is used in rare emergencies.', 'Incision: A doctor usually makes a horizontal incision across the lower abdomen (the ""bikini cut""), followed by an incision in the uterus.', 'Delivery & Recovery: The baby is delivered within minutes. The entire surgery takes about 15–30 minutes, though preparation takes longer.', 'Recovery time: A hospital stay usually lasts 3 to 5 days, with full recovery taking up to 6 weeks.']","[{'title': 'C-Section (Cesarean Section): Procedure, Risks & Recovery', 'link': 'https://my.clevelandclinic.org/health/treatments/7246-cesarean-birth-c-section', 'source': 'Cleveland Clinic'}, {'title': 'Caesarean section - Better Health Channel', 'link': 'https://www.betterhealth.vic.gov.au/health/healthyliving/caesarean-section', 'source': 'Better Health Channel'}, {'title': 'Caesarean section - Wikipedia', 'link': 'https://en.wikipedia.org/wiki/Caesarean_section', 'source': 'Wikipedia'}, {'title': 'A cesarean section | known as a C-section | is a surgery to deliver a ...', 'link': 'https://www.youtube.com/watch?v=pSJcxYg1QQ4&t=3', 'source': 'YouTube'}, {'title': 'C-section (Cesarean Delivery)', 'link': 'https://www.youtube.com/watch?v=xyN48VnRYUY', 'source': 'YouTube'}, {'title': 'Reasons for a Cesarean Birth', 'link': 'https://americanpregnancy.org/giving-birth/reasons-for-a-cesarean/', 'source': 'American Pregnancy Association'}, {'title': 'When Is a Cesarean Delivery Necessary', 'link': 'https://www.obgynassociatesmarietta.com/blog/when-is-a-cesarean-delivery-necessary', 'source': 'OB-GYN Associates of Marietta'}, {'title': 'C-section - Mayo Clinic', 'link': 'https://www.mayoclinic.org/tests-procedures/c-section/about/pac-20393655', 'source': 'Mayo Clinic'}, {'title': 'C-Section', 'link': 'https://miraclehospital.care/c-section/', 'source': 'Miracle Hospital'}, {'title': 'Caesarean Section: What to Expect at Home - My Health Alberta', 'link': 'https://myhealth.alberta.ca/Health/aftercareinformation/pages/conditions.aspx?hwid=ud1242', 'source': 'My Health Alberta'}, {'title': 'Lower section Caesarean Delivery | Apollo Cradle', 'link': 'https://www.apollocradle.com/blog/pregnancy/lower-section-caesarean', 'source': ""Apollo Cradle & Children's Hospital""}, {'title': 'Childbirth: Slight Risk in Vaginal Birth After C-Section (Published 2012)', 'link': 'https://www.nytimes.com/2012/03/27/health/research/slight-risk-in-vaginal-birth-after-c-section.html', 'source': 'The New York Times'}]","[{'title': 'C-section - Mayo Clinic', 'link': 'https://www.mayoclinic.org/tests-procedures/c-section/about/pac-20393655', 'source': 'Mayo Clinic'}, {'title': 'C-Section (Cesarean Section): Procedure, Risks & Recovery', 'link': 'https://my.clevelandclinic.org/health/treatments/7246-cesarean-birth-c-section', 'source': 'Cleveland Clinic'}, {'title': 'Caesarean section - Wikipedia', 'link': 'https://en.wikipedia.org/wiki/Caesarean_section', 'source': 'Wikipedia'}, {'title': 'C-section (Cesarean Delivery)', 'link': 'https://www.youtube.com/watch?v=xyN48VnRYUY', 'source': 'YouTube'}, {'title': 'A cesarean section | known as a C-section | is a surgery to deliver a ...', 'link': 'https://www.youtube.com/watch?t=3&v=pSJcxYg1QQ4', 'source': 'YouTube'}, {'title': 'Caesarean section - Better Health Channel', 'link': 'https://www.betterhealth.vic.gov.au/health/healthyliving/caesarean-section', 'source': 'Better Health Channel'}, {'title': 'Caesarean Section: What to Expect at Home - My Health Alberta', 'link': 'https://myhealth.alberta.ca/Health/aftercareinformation/pages/conditions.aspx?hwid=ud1242', 'source': 'My Health Alberta'}, {'title': 'A cesarean section | known as a C-section | is a surgery to deliver a ...', 'link': 'https://www.youtube.com/watch?v=pSJcxYg1QQ4&t=3', 'source': 'YouTube'}, {'title': 'Reasons for a Cesarean Birth', 'link': 'https://americanpregnancy.org/giving-birth/reasons-for-a-cesarean/', 'source': 'American Pregnancy Association'}, {'title': 'When Is a Cesarean Delivery Necessary', 'link': 'https://www.obgynassociatesmarietta.com/blog/when-is-a-cesarean-delivery-necessary', 'source': 'OB-GYN Associates of Marietta'}, {'title': 'C-Section', 'link': 'https://miraclehospital.care/c-section/', 'source': 'Miracle Hospital'}, {'title': 'Lower section Caesarean Delivery | Apollo Cradle', 'link': 'https://www.apollocradle.com/blog/pregnancy/lower-section-caesarean', 'source': ""Apollo Cradle & Children's Hospital""}, {'title': 'Childbirth: Slight Risk in Vaginal Birth After C-Section (Published 2012)', 'link': 'https://www.nytimes.com/2012/03/27/health/research/slight-risk-in-vaginal-birth-after-c-section.html', 'source': 'The New York Times'}]","['What exactly happens during a C-section?', 'Is a C-section safer than birth?', 'Is a C-section painful?', 'How serious is a C-section?']"
Nigeria,how to prepare for labor and delivery,True,"['Exercise: Perform prenatal yoga, squats, pelvic tilts, and hip circles to strengthen muscles and increase pelvic flexibility.', 'Perineal Massage: Massaging the perineum in the final weeks can prepare tissue for stretching.', 'Pelvic Floor Exercises: Practice Kegels to help with control during pushing.', 'Stay Active: Regular walking and swimming help improve stamina for labor.', 'Childbirth Education Classes: Understand the stages of labor and pain management options.', 'Birth Plan/Preferences: Outline preferences for pain relief, environment, and immediate postpartum care, but remain flexible.', 'Relaxation Techniques: Practice meditation, breathing exercises, or visualization to manage fear and pain.', 'Support Team: Hire a doula or designate a support person, such as a partner or family member.', 'Hospital Bag Checklist: Pack clothes for you and the baby, toiletries, snacks, ID, and comfort items (music, pillows).', 'Install Car Seat: Ensure the car seat is properly installed by 37 weeks.', 'Hospital Plan: Know the route to the hospital and when to call the doctor (e.g., water breaks, regular contractions).', 'Stay Hydrated & Nourished: Eat light, nutritious meals and drink water to maintain energy.', 'Move: Walk around, sway, or use a birth ball to help with comfort and positioning.', 'Rest: Try to rest or sleep during early labor when contractions are manageable.']","[{'title': '7 Ways To Prepare For Birth | 3rd Trimester Easy Birth Prep', 'link': 'https://www.youtube.com/watch?v=Q6213lkGvyc&t=47', 'source': 'YouTube'}, {'title': 'How to Prepare for a Normal Delivery | Must-Know Tips for Every Mom-to ...', 'link': 'https://www.youtube.com/shorts/11aTWn2Yvuo', 'source': 'YouTube'}, {'title': 'How to Prepare for Labor and Birth | Bump & Beyond | Boston Medical ...', 'link': 'https://www.bmc.org/bump-beyond/labor-and-birth/preparing-birth/how-prepare-labor-and-birth', 'source': 'Boston Medical Center'}, {'title': 'Hospital bag checklist - Best Start in Life - NHS', 'link': 'https://www.nhs.uk/best-start-in-life/pregnancy/preparing-for-labour-and-birth/hospital-bag-checklist/', 'source': 'nhs.uk'}, {'title': 'Preparing your body for labour and birth - HSE', 'link': 'https://www2.hse.ie/pregnancy-birth/labour/preparing/preparing-your-body/', 'source': 'HSE website'}, {'title': 'Best Pregnancy Exercises For An Easy Labor (Includes Pushing ...', 'link': 'https://www.youtube.com/watch?v=hv3zWRKv6WY&t=7', 'source': 'YouTube'}, {'title': 'Prepare for Labour with Effective Pushing Techniques: Expert Tips ...', 'link': 'https://www.youtube.com/watch?v=-lCcFxtGSg4&t=66', 'source': 'YouTube'}, {'title': 'Learn secrets for an easier labor and delivery - Sanford Health News', 'link': 'https://news.sanfordhealth.org/womens/secrets-for-an-easier-labor/', 'source': 'Sanford Health News'}, {'title': '5 positive ways to prepare for labour', 'link': 'https://www.tommys.org/pregnancy-information/giving-birth/5-positive-ways-prepare-labour', 'source': ""Tommy's | The pregnancy and baby charity""}, {'title': '8 ways to prepare for natural birth: Easing labor pain without an epidural | Nebraska Medicine Omaha, NE', 'link': 'https://www.nebraskamed.com/health/healthy-lifestyle/pregnancy-and-birth/8-ways-to-prepare-for-natural-birth-easing-labor-pain', 'source': 'Nebraska Medicine'}, {'title': 'Understanding Labor Stages: Tips & Comfort', 'link': 'https://sleepybelly.com.au/blogs/blog/understanding-the-stages-of-labor-what-to-expect-during-each-phase', 'source': 'Sleepybelly'}, {'title': 'What to bring to your labor and delivery - MedlinePlus', 'link': 'https://medlineplus.gov/ency/patientinstructions/000543.htm', 'source': 'MedlinePlus (.gov)'}, {'title': 'Preparing for Labor & Delivery - UCLA Health', 'link': 'https://www.uclahealth.org/medical-services/birthplace/pregnancy-newborn-health/prenatal-education/preparing-labor-delivery', 'source': 'UCLA Health'}, {'title': 'Top 10 Tips For Normal Delivery', 'link': 'https://cradlehospital.com/tips-for-normal-delivery/', 'source': 'Cradle Children Hospital'}, {'title': '11 Tips for an Easier and Smoother Labor Experience - Parents', 'link': 'https://www.parents.com/pregnancy/giving-birth/labor-and-delivery/10-secrets-to-an-easier-labor/', 'source': 'Parents'}, {'title': 'Preparing for Birth: How Simple Habits Can Help Create a Smooth Labor & Delivery', 'link': 'https://heydianahealth.com/prepare-for-labor-and-birth/', 'source': 'Diana Health'}]","[{'title': '5 positive ways to prepare for labour', 'link': 'https://www.tommys.org/pregnancy-information/giving-birth/5-positive-ways-prepare-labour', 'source': ""Tommy's | The pregnancy and baby charity""}, {'title': 'Preparing your body for labour and birth - HSE', 'link': 'https://www2.hse.ie/pregnancy-birth/labour/preparing/preparing-your-body/', 'source': 'HSE website'}, {'title': '8 ways to prepare for natural birth: Easing labor pain without an epidural | Nebraska Medicine Omaha, NE', 'link': 'https://www.nebraskamed.com/health/healthy-lifestyle/pregnancy-and-birth/8-ways-to-prepare-for-natural-birth-easing-labor-pain', 'source': 'Nebraska Medicine'}, {'title': 'What to bring to your labor and delivery - MedlinePlus', 'link': 'https://medlineplus.gov/ency/patientinstructions/000543.htm', 'source': 'MedlinePlus (.gov)'}, {'title': '7 Ways To Prepare For Birth | 3rd Trimester Easy Birth Prep', 'link': 'https://www.youtube.com/watch?t=47&v=Q6213lkGvyc', 'source': 'YouTube'}, {'title': 'Best Pregnancy Exercises For An Easy Labor (Includes Pushing ...', 'link': 'https://www.youtube.com/watch?t=7&v=hv3zWRKv6WY', 'source': 'YouTube'}, {'title': 'Hospital bag checklist - Best Start in Life - NHS', 'link': 'https://www.nhs.uk/best-start-in-life/pregnancy/preparing-for-labour-and-birth/hospital-bag-checklist/', 'source': 'nhs.uk'}, {'title': 'Learn secrets for an easier labor and delivery - Sanford Health News', 'link': 'https://news.sanfordhealth.org/womens/secrets-for-an-easier-labor/', 'source': 'Sanford Health News'}, {'title': '11 Tips for an Easier and Smoother Labor Experience - Parents', 'link': 'https://www.parents.com/pregnancy/giving-birth/labor-and-delivery/10-secrets-to-an-easier-labor/', 'source': 'Parents'}, {'title': 'How to Prepare for Labor and Birth | Bump & Beyond | Boston Medical ...', 'link': 'https://www.bmc.org/bump-beyond/labor-and-birth/preparing-birth/how-prepare-labor-and-birth', 'source': 'Boston Medical Center'}, {'title': 'Prepare for Labour with Effective Pushing Techniques: Expert Tips ...', 'link': 'https://www.youtube.com/watch?t=66&v=-lCcFxtGSg4', 'source': 'YouTube'}, {'title': 'How to Prepare for a Normal Delivery | Must-Know Tips for Every Mom-to ...', 'link': 'https://www.youtube.com/shorts/11aTWn2Yvuo', 'source': 'YouTube'}, {'title': '7 Ways To Prepare For Birth | 3rd Trimester Easy Birth Prep', 'link': 'https://www.youtube.com/watch?v=Q6213lkGvyc&t=47', 'source': 'YouTube'}, {'title': 'Best Pregnancy Exercises For An Easy Labor (Includes Pushing ...', 'link': 'https://www.youtube.com/watch?v=hv3zWRKv6WY&t=7', 'source': 'YouTube'}, {'title': 'Prepare for Labour with Effective Pushing Techniques: Expert Tips ...', 'link': 'https://www.youtube.com/watch?v=-lCcFxtGSg4&t=66', 'source': 'YouTube'}, {'title': 'Understanding Labor Stages: Tips & Comfort', 'link': 'https://sleepybelly.com.au/blogs/blog/understanding-the-stages-of-labor-what-to-expect-during-each-phase', 'source': 'Sleepybelly'}, {'title': 'Preparing for Labor & Delivery - UCLA Health', 'link': 'https://www.uclahealth.org/medical-services/birthplace/pregnancy-newborn-health/prenatal-education/preparing-labor-delivery', 'source': 'UCLA Health'}, {'title': 'Top 10 Tips For Normal Delivery', 'link': 'https://cradlehospital.com/tips-for-normal-delivery/', 'source': 'Cradle Children Hospital'}, {'title': 'Preparing for Birth: How Simple Habits Can Help Create a Smooth Labor & Delivery', 'link': 'https://heydianahealth.com/prepare-for-labor-and-birth/', 'source': 'Diana Health'}]","['How do I prepare my body for labor and delivery?', 'How can I make labor easier and faster?', 'What to do 2 days before delivery?', 'What can I drink to open my cervix?']"
