location,query,has_ai_overview,all_items,cited_sources,all_references,paa_questions
Nigeria,what is IVF,True,"['Meaning: ""In vitro"" means ""in glass"" (laboratory dish), representing fertilization outside the human body.', 'Purpose: It is used to treat infertility, including conditions like blocked fallopian tubes, low sperm count, or unexplained infertility.', ""Usage: It can use a couple's own eggs and sperm or, in some cases, donor sperm, eggs, or embryos."", 'Stimulation (Super Ovulation): Medications are given to stimulate the ovaries to produce multiple eggs rather than the single egg that typically matures each month.', 'Egg Retrieval: A minor surgical procedure is performed to remove the eggs from the ovarian follicles.', 'Insemination/Fertilization: The retrieved eggs are mixed with sperm in a laboratory setting to facilitate fertilization.', 'Embryo Culture: The fertilized eggs develop into embryos over several days in an incubator.', 'Transfer: One or more embryos are transferred directly into the uterus (womb) to implant and grow.', 'Age: Younger patients typically have higher success rates.', 'Cause of Infertility: The underlying reason for needing IVF.', 'Embryo Quality: The health of the developed embryos.']","[{'title': 'In vitro fertilization (IVF) - Mayo Clinic', 'link': 'https://www.mayoclinic.org/tests-procedures/in-vitro-fertilization/about/pac-20384716', 'source': 'Mayo Clinic'}, {'title': 'What Is In-Vitro-Fertilization (IVF)? - Planned Parenthood', 'link': 'https://www.plannedparenthood.org/learn/pregnancy/fertility-treatments/what-ivf', 'source': 'Planned Parenthood'}, {'title': 'In vitro fertilization (IVF): MedlinePlus Medical Encyclopedia', 'link': 'https://medlineplus.gov/ency/article/007279.htm', 'source': 'MedlinePlus (.gov)'}, {'title': 'What is IVF and How it Works - My 1Health', 'link': 'https://my1health.com/articles/what-is-ivf-and-how-it-works', 'source': 'My 1Health'}, {'title': 'What is IVF? Step by Step of the IVF Process to Get Pregnant', 'link': 'https://www.youtube.com/watch?v=sHXYulkc3S4&t=26', 'source': 'YouTube'}, {'title': 'In Vitro Fertilization (IVF)', 'link': 'https://www.youtube.com/watch?v=uXsCngh89fI&t=23', 'source': 'YouTube'}, {'title': 'How Does IVF Work?', 'link': 'https://www.youtube.com/shorts/rsJPTBxy0DQ', 'source': 'YouTube'}, {'title': 'In Vitro Fertilization(IVF) for Infertility: Procedure, Risks, and Success Rate', 'link': 'https://www.webmd.com/infertility-and-reproduction/in-vitro-fertilization', 'source': 'WebMD'}, {'title': 'IVF (In Vitro Fertilization): Procedure & How It Works - Lily Hospitals', 'link': 'https://lilyhospitals.com/in-vitro-fertilization-ivf/', 'source': 'Lily Hospitals'}, {'title': 'How IVF Works | The Story of Fertility | BBC Earth Science', 'link': 'https://www.youtube.com/watch?v=YWrgyHn0VSY&t=1', 'source': 'YouTube'}]","[{'title': 'In vitro fertilization (IVF) - Mayo Clinic', 'link': 'https://www.mayoclinic.org/tests-procedures/in-vitro-fertilization/about/pac-20384716', 'source': 'Mayo Clinic'}, {'title': 'In vitro fertilization (IVF): MedlinePlus Medical Encyclopedia', 'link': 'https://medlineplus.gov/ency/article/007279.htm', 'source': 'MedlinePlus (.gov)'}, {'title': 'What Is In-Vitro-Fertilization (IVF)? - Planned Parenthood', 'link': 'https://www.plannedparenthood.org/learn/pregnancy/fertility-treatments/what-ivf', 'source': 'Planned Parenthood'}, {'title': 'In Vitro Fertilization (IVF)', 'link': 'https://www.youtube.com/watch?t=23&v=uXsCngh89fI', 'source': 'YouTube'}, {'title': 'How Does IVF Work?', 'link': 'https://www.youtube.com/shorts/rsJPTBxy0DQ', 'source': 'YouTube'}, {'title': 'IVF (In Vitro Fertilization): Procedure & How It Works - Lily Hospitals', 'link': 'https://lilyhospitals.com/in-vitro-fertilization-ivf/', 'source': 'Lily Hospitals'}, {'title': 'What is IVF? Step by Step of the IVF Process to Get Pregnant', 'link': 'https://www.youtube.com/watch?t=26&v=sHXYulkc3S4', 'source': 'YouTube'}, {'title': 'What is IVF and How it Works - My 1Health', 'link': 'https://my1health.com/articles/what-is-ivf-and-how-it-works', 'source': 'My 1Health'}, {'title': 'How IVF Works | The Story of Fertility | BBC Earth Science', 'link': 'https://www.youtube.com/watch?t=1&v=YWrgyHn0VSY', 'source': 'YouTube'}, {'title': 'What is IVF? Step by Step of the IVF Process to Get Pregnant', 'link': 'https://www.youtube.com/watch?v=sHXYulkc3S4&t=26', 'source': 'YouTube'}, {'title': 'In Vitro Fertilization (IVF)', 'link': 'https://www.youtube.com/watch?v=uXsCngh89fI&t=23', 'source': 'YouTube'}, {'title': 'How IVF Works | The Story of Fertility | BBC Earth Science', 'link': 'https://www.youtube.com/watch?v=YWrgyHn0VSY&t=1', 'source': 'YouTube'}, {'title': 'In Vitro Fertilization(IVF) for Infertility: Procedure, Risks, and Success Rate', 'link': 'https://www.webmd.com/infertility-and-reproduction/in-vitro-fertilization', 'source': 'WebMD'}]","['What exactly is done in IVF?', 'How much does IVF cost in Nigeria?', 'Who carries the baby during IVF?', 'How long does IVF take to get pregnant?']"
Nigeria,IVF success rates by age,True,[],[],[],"['What are the odds of IVF working first time?', 'At what age is IVF most successful?', 'Why are IVF babies usually boys?', 'What stage does most IVF fail?']"
Nigeria,what is IUI treatment,True,"['Procedure: A thin, flexible tube (catheter) is inserted through the cervix into the uterus to deposit washed and concentrated sperm. The procedure is fast, usually painless (similar to a Pap smear), and done in a clinic.', 'Purpose: To increase the number of sperm that reach the fallopian tubes, increasing the likelihood of pregnancy.', 'Timing: It is timed with ovulation, which may be monitored naturally or induced using fertility medications.', 'Best For: Individuals with unexplained infertility, mild male factor infertility, cervical issues, or those using donor sperm.', 'IUI vs. IVF: IUI is less invasive and less expensive than In Vitro Fertilization (IVF). Unlike IVF, where fertilization happens in a lab, IUI relies on fertilization occurring inside the body.', 'Success Rates: Success depends on factors like age and the reason for infertility, with success rates often around 20% per cycle.', 'Low sperm count or reduced sperm motility.', 'Cervical mucus issues that hinder sperm.', 'Ejaculation dysfunction.', 'Unexplained infertility.', 'Single individuals or same-sex couples using donor sperm.']","[{'title': 'IUI (Intrauterine Insemination) - Cleveland Clinic', 'link': 'https://my.clevelandclinic.org/health/treatments/22456-iui-intrauterine-insemination', 'source': 'Cleveland Clinic'}, {'title': 'Infertility Services: Intrauterine Insemination (IUI) Treatment', 'link': 'https://www.hopkinsmedicine.org/gynecology-obstetrics/specialty-areas/fertility-center/infertility-services/intrauterine-insemination', 'source': 'Johns Hopkins Medicine'}, {'title': 'Fertility Treatment: Artificial Insemination (IUI)', 'link': 'https://www.youtube.com/watch?v=S6FmkzOf9ao&t=22', 'source': 'YouTube'}, {'title': 'Intrauterine Insemination (IUI): What it is and How it Works', 'link': 'https://androcarefertilityng.org/intrauterine-insemination-iui-what-it-is-and-how-it-works/', 'source': 'Androcare Fertility Centre'}, {'title': 'Is IUI Painful? What to Expect Before, During & After the Procedure', 'link': 'https://www.rainbowhospitals.in/blog/is-iui-painful-what-to-expect-before-during-and-after-the-procedure', 'source': 'Rainbow Hospitals'}, {'title': 'Intrauterine insemination (IUI) - Mayo Clinic', 'link': 'https://www.mayoclinic.org/tests-procedures/intrauterine-insemination/about/pac-20384722', 'source': 'Mayo Clinic'}, {'title': 'What is an IUI? How to Get Pregnant With an IUI?Top Tips for Intrauterine ...', 'link': 'https://www.youtube.com/watch?v=QyA5NPpRjZ4&t=197', 'source': 'YouTube'}, {'title': 'What Is IUI Process? | The Bridge Clinic', 'link': 'https://thebridgeclinic.com/what-is-the-iui-process/', 'source': 'thebridgeclinic.com'}, {'title': 'What Is IUI Treatment vs IVF | The Bridge Clinic', 'link': 'https://thebridgeclinic.com/what-is-iui-treatment-vs-ivf/', 'source': 'thebridgeclinic.com'}, {'title': 'IUI procedure: Step by step, cost, success rate, and more', 'link': 'https://www.medicalnewstoday.com/articles/iui-procedure', 'source': 'Medical News Today'}, {'title': 'Best IVF Hospital/Center in India - Top Fertility Clinic | Milann The Fertility Specialists', 'link': 'https://www.milann.co.in/blogs/ivf-or-iui-which-is-a-better-option-for-you', 'source': 'Milann Fertility Hospital'}, {'title': 'IVF, IUI, or ICSI: Which Fertility Treatment Is Right for You?', 'link': 'https://www.youtube.com/shorts/eHIYDpQtvio', 'source': 'YouTube'}, {'title': 'What You Should Know About Intrauterine Insemination (IUI)', 'link': 'https://ro.co/fertility/iui/', 'source': 'Ro'}, {'title': 'Who Needs Intrauterine Insemination (IUI)?', 'link': 'https://zivafertility.com/who-needs-intrauterine-insemination-iui/', 'source': 'Ziva Fertility'}]","[{'title': 'IUI (Intrauterine Insemination) - Cleveland Clinic', 'link': 'https://my.clevelandclinic.org/health/treatments/22456-iui-intrauterine-insemination', 'source': 'Cleveland Clinic'}, {'title': 'Fertility Treatment: Artificial Insemination (IUI)', 'link': 'https://www.youtube.com/watch?t=22&v=S6FmkzOf9ao', 'source': 'YouTube'}, {'title': 'Intrauterine insemination (IUI) - Mayo Clinic', 'link': 'https://www.mayoclinic.org/tests-procedures/intrauterine-insemination/about/pac-20384722', 'source': 'Mayo Clinic'}, {'title': 'What Is IUI Process? | The Bridge Clinic', 'link': 'https://thebridgeclinic.com/what-is-the-iui-process/', 'source': 'thebridgeclinic.com'}, {'title': 'IUI procedure: Step by step, cost, success rate, and more', 'link': 'https://www.medicalnewstoday.com/articles/iui-procedure', 'source': 'Medical News Today'}, {'title': 'Infertility Services: Intrauterine Insemination (IUI) Treatment', 'link': 'https://www.hopkinsmedicine.org/gynecology-obstetrics/specialty-areas/fertility-center/infertility-services/intrauterine-insemination', 'source': 'Johns Hopkins Medicine'}, {'title': 'What Is IUI Treatment vs IVF | The Bridge Clinic', 'link': 'https://thebridgeclinic.com/what-is-iui-treatment-vs-ivf/', 'source': 'thebridgeclinic.com'}, {'title': 'What is an IUI? How to Get Pregnant With an IUI?Top Tips for Intrauterine ...', 'link': 'https://www.youtube.com/watch?t=197&v=QyA5NPpRjZ4', 'source': 'YouTube'}, {'title': 'Intrauterine Insemination (IUI): What it is and How it Works', 'link': 'https://androcarefertilityng.org/intrauterine-insemination-iui-what-it-is-and-how-it-works/', 'source': 'Androcare Fertility Centre'}, {'title': 'Is IUI Painful? What to Expect Before, During & After the Procedure', 'link': 'https://www.rainbowhospitals.in/blog/is-iui-painful-what-to-expect-before-during-and-after-the-procedure', 'source': 'Rainbow Hospitals'}, {'title': 'Fertility Treatment: Artificial Insemination (IUI)', 'link': 'https://www.youtube.com/watch?v=S6FmkzOf9ao&t=22', 'source': 'YouTube'}, {'title': 'What is an IUI? How to Get Pregnant With an IUI?Top Tips for Intrauterine ...', 'link': 'https://www.youtube.com/watch?v=QyA5NPpRjZ4&t=197', 'source': 'YouTube'}, {'title': 'Best IVF Hospital/Center in India - Top Fertility Clinic | Milann The Fertility Specialists', 'link': 'https://www.milann.co.in/blogs/ivf-or-iui-which-is-a-better-option-for-you', 'source': 'Milann Fertility Hospital'}, {'title': 'IVF, IUI, or ICSI: Which Fertility Treatment Is Right for You?', 'link': 'https://www.youtube.com/shorts/eHIYDpQtvio', 'source': 'YouTube'}, {'title': 'What You Should Know About Intrauterine Insemination (IUI)', 'link': 'https://ro.co/fertility/iui/', 'source': 'Ro'}, {'title': 'Who Needs Intrauterine Insemination (IUI)?', 'link': 'https://zivafertility.com/who-needs-intrauterine-insemination-iui/', 'source': 'Ziva Fertility'}]","['Is IUI 100% successful?', 'Is IUI better than IVF?', 'Is it painful to have an IUI?', 'How long does it take to get pregnant using IUI?']"
Nigeria,PCOS and fertility,True,"['Anovulation: The primary issue is irregular or absent ovulation, meaning eggs are not released regularly.', 'Hormonal Imbalance: High levels of androgens (male hormones) and insulin resistance can interfere with egg development.', 'Pregnancy Risks: Women with PCOS have a higher risk of gestational diabetes, miscarriage, and pregnancy complications.', 'Lifestyle Changes: For those with obesity, a 5-10% weight loss can restore regular ovulation and improve fertility.', 'Medication (First-Line): Letrozole is often preferred to encourage ovulation, followed by clomiphene citrate.', 'Metformin: Used to improve ovulation rates by treating insulin resistance.', 'Assisted Reproductive Technology (ART): If medicines are ineffective, IVF has high success rates for women with PCOS.', 'Age Factor: Women with PCOS may have a better ovarian reserve as they age, with many finding their cycles become more regular in their 30s.', 'Medical Guidance: It is essential to consult a reproductive endocrinologist for a personalized plan to manage irregular periods and trigger ovulation.']","[{'title': ""Polycystic ovary syndrome - Women's Health.gov"", 'link': 'https://womenshealth.gov/a-z-topics/polycystic-ovary-syndrome', 'source': ""Office on Women's Health (.gov)""}, {'title': 'Polycystic ovary syndrome - World Health Organization (WHO)', 'link': 'https://www.who.int/news-room/fact-sheets/detail/polycystic-ovary-syndrome', 'source': 'World Health Organization (WHO)'}, {'title': 'PCOS (Polycystic Ovary Syndrome): Symptoms & Treatment', 'link': 'https://my.clevelandclinic.org/health/diseases/8316-polycystic-ovary-syndrome-pcos', 'source': 'Cleveland Clinic'}, {'title': 'Management strategy of infertility in polycystic ovary syndrome', 'link': 'https://www.sciencedirect.com/science/article/pii/S2414644722000240', 'source': 'ScienceDirect.com'}, {'title': 'Treatments for Infertility Resulting from PCOS - NICHD', 'link': 'https://www.nichd.nih.gov/health/topics/pcos/conditioninfo/treatments/infertility', 'source': 'National Institute of Child Health and Human Development (.gov)'}, {'title': 'The Role of Polycystic Ovary Syndrome in Reproductive and ... - PMC', 'link': 'https://pmc.ncbi.nlm.nih.gov/articles/PMC4433074/', 'source': 'National Institutes of Health (.gov)'}, {'title': 'PCOS and Infertility | Johns Hopkins Medicine', 'link': 'https://www.hopkinsmedicine.org/health/expert-qa/pcos-and-infertility', 'source': 'Johns Hopkins Medicine'}, {'title': 'PCOS and Infertility : How PCOS can affect your fertility', 'link': 'https://www.femcarefertility.com/blog/pcos-and-infertility-how-pcos-affect-your-fertility/', 'source': 'Femcare Fertility'}, {'title': 'Fertility and age at childbirth in polycystic ovary syndrome', 'link': 'https://www.sciencedirect.com/science/article/pii/S0002937824011359', 'source': 'ScienceDirect.com'}, {'title': 'PCOS and Fertility: What Treatment Actually Works (Backed by Science)', 'link': 'https://www.youtube.com/watch?v=_L24xoG5EVw', 'source': 'YouTube'}]","[{'title': ""Polycystic ovary syndrome - Women's Health.gov"", 'link': 'https://womenshealth.gov/a-z-topics/polycystic-ovary-syndrome', 'source': ""Office on Women's Health (.gov)""}, {'title': 'PCOS and Infertility | Johns Hopkins Medicine', 'link': 'https://www.hopkinsmedicine.org/health/expert-qa/pcos-and-infertility', 'source': 'Johns Hopkins Medicine'}, {'title': 'Polycystic ovary syndrome - World Health Organization (WHO)', 'link': 'https://www.who.int/news-room/fact-sheets/detail/polycystic-ovary-syndrome', 'source': 'World Health Organization (WHO)'}, {'title': 'Treatments for Infertility Resulting from PCOS - NICHD', 'link': 'https://www.nichd.nih.gov/health/topics/pcos/conditioninfo/treatments/infertility', 'source': 'National Institute of Child Health and Human Development (.gov)'}, {'title': 'Management strategy of infertility in polycystic ovary syndrome', 'link': 'https://www.sciencedirect.com/science/article/pii/S2414644722000240', 'source': 'ScienceDirect.com'}, {'title': 'The Role of Polycystic Ovary Syndrome in Reproductive and ... - PMC', 'link': 'https://pmc.ncbi.nlm.nih.gov/articles/PMC4433074/', 'source': 'National Institutes of Health (.gov)'}, {'title': 'Fertility and age at childbirth in polycystic ovary syndrome', 'link': 'https://www.sciencedirect.com/science/article/pii/S0002937824011359', 'source': 'ScienceDirect.com'}, {'title': 'PCOS and Fertility: What Treatment Actually Works (Backed by Science)', 'link': 'https://www.youtube.com/watch?v=_L24xoG5EVw', 'source': 'YouTube'}, {'title': 'PCOS (Polycystic Ovary Syndrome): Symptoms & Treatment', 'link': 'https://my.clevelandclinic.org/health/diseases/8316-polycystic-ovary-syndrome-pcos', 'source': 'Cleveland Clinic'}, {'title': 'PCOS and Infertility : How PCOS can affect your fertility', 'link': 'https://www.femcarefertility.com/blog/pcos-and-infertility-how-pcos-affect-your-fertility/', 'source': 'Femcare Fertility'}]","['Can I get pregnant normally with PCOS?', 'How do I know if I am ovulating with PCOS?', 'Does having PCOS reduce fertility?', 'What is the best fertility treatment for PCOS?']"
Nigeria,how does egg freezing work,True,"['Initial Consult & Screening: Doctors assess your ovarian reserve via blood tests and ultrasounds to determine the appropriate hormone dosage.', 'Ovarian Stimulation (10-12 days): You self-administer hormone injections to stimulate the ovaries to mature multiple eggs rather than the single egg normally produced monthly. Regular monitoring visits (ultrasounds/blood tests) check follicle growth.', 'Trigger Shot: When follicles are mature, a final ""trigger shot"" (hCG or Lupron) is given to finalize egg maturation.', 'Egg Retrieval (10-30 mins): A fertility specialist performs an outpatient, ultrasound-guided procedure while you are under sedation to retrieve the eggs via a needle passed through the vaginal wall.', 'Freezing (Vitrification): Embryologists immediately freeze the mature eggs using vitrification, an ultra-rapid cooling technique that prevents ice crystals from damaging the cell.', 'Success Rates: The best outcomes occur when eggs are frozen under age 35, although it is common up to 38.', 'Number of Eggs: Generally, 15-20 mature eggs are recommended for a high probability of a live birth.', 'Storage & Usage: Eggs can be stored for many years. When ready, they are thawed, fertilized with sperm via ICSI (intracytoplasmic sperm injection), and the resulting embryo is transferred to the uterus.', 'Side Effects: Mild cramping, bloating, or mood swings from medications are common, but serious complications are rare.']","[{'title': 'Egg Freezing: Process, Cost, and What to Expect - Healthline', 'link': 'https://www.healthline.com/health/egg-freezing-process', 'source': 'Healthline'}, {'title': 'How Does Egg Freezing Work? A Fertility Doctor Explains', 'link': 'https://www.illumefertility.com/fertility-blog/how-does-egg-freezing-work', 'source': 'Illume Fertility'}, {'title': 'How Does Egg Freezing Work & What Should I Expect?', 'link': 'https://www.drrachaelknight.com.au/resources/egg-freezing-what-to-expect/', 'source': 'Dr Rachael Knight'}, {'title': 'Egg freezing: a factsheet - HFEA', 'link': 'https://www.hfea.gov.uk/about-us/media-centre/egg-freezing-a-factsheet/', 'source': 'HFEA'}, {'title': 'Egg freezing - Fertility Associates', 'link': 'https://www.fertilityassociates.co.nz/egg-freezing', 'source': 'Fertility Associates'}, {'title': 'Freezing Eggs: Preserving Fertility for the Future | Johns Hopkins Medicine', 'link': 'https://www.hopkinsmedicine.org/health/wellness-and-prevention/freezing-eggs-preserving-fertility-for-the-future', 'source': 'Johns Hopkins Medicine'}, {'title': 'How Does Egg Freezing Work - Texas Fertility Center', 'link': 'https://txfertility.com/egg-freezing/how-does-egg-freezing-work/', 'source': 'Texas Fertility Center'}, {'title': 'How Does Egg Freezing Work? A Step-by-Step Guide for Women', 'link': 'https://proactiveforher.com/blogs/fertility/how-does-egg-freezing-work-a-step-by-step-guide-for-women/', 'source': 'Proactive For Her'}, {'title': 'Egg Freezing: What You Should Know - WebMD', 'link': 'https://www.webmd.com/infertility-and-reproduction/egg-freezing', 'source': 'WebMD'}, {'title': 'Egg Freezing - Penn Medicine', 'link': 'https://www.pennmedicine.org/treatments/egg-freezing', 'source': 'Penn Medicine'}, {'title': 'Egg freezing and storage - Guys and St Thomas Specialist Care', 'link': 'https://guysandstthomasspecialistcare.co.uk/treatments/egg-freezing-and-storage/', 'source': ""Guy's and St Thomas' Specialist Care""}, {'title': 'How Frozen Eggs Are Used - Extend Fertility', 'link': 'https://extendfertility.com/your-fertility-3/how-frozen-eggs-are-used/', 'source': 'Extend Fertility'}, {'title': 'Egg Freezing: What to Know About Preserving Your Fertility', 'link': 'https://www.youtube.com/watch?v=LKIuisHqcdg', 'source': 'YouTube'}]","[{'title': 'Egg Freezing: Process, Cost, and What to Expect - Healthline', 'link': 'https://www.healthline.com/health/egg-freezing-process', 'source': 'Healthline'}, {'title': 'How Does Egg Freezing Work? A Fertility Doctor Explains', 'link': 'https://www.illumefertility.com/fertility-blog/how-does-egg-freezing-work', 'source': 'Illume Fertility'}, {'title': 'Freezing Eggs: Preserving Fertility for the Future | Johns Hopkins Medicine', 'link': 'https://www.hopkinsmedicine.org/health/wellness-and-prevention/freezing-eggs-preserving-fertility-for-the-future', 'source': 'Johns Hopkins Medicine'}, {'title': 'Egg Freezing - Penn Medicine', 'link': 'https://www.pennmedicine.org/treatments/egg-freezing', 'source': 'Penn Medicine'}, {'title': 'How Does Egg Freezing Work - Texas Fertility Center', 'link': 'https://txfertility.com/egg-freezing/how-does-egg-freezing-work/', 'source': 'Texas Fertility Center'}, {'title': 'Egg freezing: a factsheet - HFEA', 'link': 'https://www.hfea.gov.uk/about-us/media-centre/egg-freezing-a-factsheet/', 'source': 'HFEA'}, {'title': 'How Does Egg Freezing Work? A Step-by-Step Guide for Women', 'link': 'https://proactiveforher.com/blogs/fertility/how-does-egg-freezing-work-a-step-by-step-guide-for-women/', 'source': 'Proactive For Her'}, {'title': 'How Does Egg Freezing Work & What Should I Expect?', 'link': 'https://www.drrachaelknight.com.au/resources/egg-freezing-what-to-expect/', 'source': 'Dr Rachael Knight'}, {'title': 'Egg freezing and storage - Guys and St Thomas Specialist Care', 'link': 'https://guysandstthomasspecialistcare.co.uk/treatments/egg-freezing-and-storage/', 'source': ""Guy's and St Thomas' Specialist Care""}, {'title': 'Egg Freezing: What You Should Know - WebMD', 'link': 'https://www.webmd.com/infertility-and-reproduction/egg-freezing', 'source': 'WebMD'}, {'title': 'Egg freezing - Fertility Associates', 'link': 'https://www.fertilityassociates.co.nz/egg-freezing', 'source': 'Fertility Associates'}, {'title': 'How Frozen Eggs Are Used - Extend Fertility', 'link': 'https://extendfertility.com/your-fertility-3/how-frozen-eggs-are-used/', 'source': 'Extend Fertility'}, {'title': 'Egg Freezing: What to Know About Preserving Your Fertility', 'link': 'https://www.youtube.com/watch?v=LKIuisHqcdg', 'source': 'YouTube'}]","['Is egg freezing a painful procedure?', 'Are you still fertile after freezing your eggs?', ""What's the best age to freeze your eggs?"", 'At what age are 90% of your eggs gone?']"
Nigeria,fertility treatment options,True,[],[],[],"['What are the three main types of fertility treatments?', 'What is the most effective fertility treatment?', 'How do I increase my fertility as a woman?', 'What is the best fertility drug to get pregnant?']"
