location,query,has_ai_overview,all_items,cited_sources,all_references,paa_questions
Nigeria,what is a vasectomy,True,"['Effectiveness: It is nearly 100% effective for permanent contraception, with a failure rate of only about 15 per 10,000 couples in the first year.', ""Procedure: Usually performed in a doctor's office in 15–20 minutes under local anesthetic."", 'Recovery: Quick recovery, often involving a few days of mild discomfort and restricted physical activity.', 'Post-Op Requirements: The procedure is not effective immediately; it usually takes about 3 months or a specific number of ejaculations for the semen to be completely clear of sperm.', 'No Impact on Sexual Performance: It does not change testosterone levels, sexual desire, erection quality, or the ability to experience orgasm.', 'No Protection Against STIs: It does not prevent the transmission of sexually transmitted infections (STIs).', 'Permanence: It is considered irreversible, as reversals are complex and not always successful.', 'Incision Method: The surgeon makes one or two small cuts in the scrotum to access the tubes.', 'No-Scalpel Method: The surgeon uses a special tool to make a tiny puncture rather than a cut, resulting in less bleeding and faster healing.', 'Vasectomy: A much simpler, safer, and cheaper procedure compared to female tubal ligation (sterilization).']","[{'title': 'Vasectomy - Mayo Clinic', 'link': 'https://www.mayoclinic.org/tests-procedures/vasectomy/about/pac-20384580', 'source': 'Mayo Clinic'}, {'title': 'Vasectomy: Procedure, Side Effects, & Costs - Birth Control - WebMD', 'link': 'https://www.webmd.com/sex/birth-control/vasectomy-overview', 'source': 'WebMD'}, {'title': 'Vasectomy - Wikipedia', 'link': 'https://en.wikipedia.org/wiki/Vasectomy', 'source': 'Wikipedia'}, {'title': 'Vasectomy: MedlinePlus Medical Encyclopedia', 'link': 'https://medlineplus.gov/ency/article/002995.htm', 'source': 'MedlinePlus (.gov)'}, {'title': 'Vasectomy - NICHD - NIH', 'link': 'https://www.nichd.nih.gov/health/topics/vasectomy', 'source': 'National Institute of Child Health and Human Development (.gov)'}, {'title': 'Everything You Need to Know About a Vasectomy', 'link': 'https://www.youtube.com/watch?v=WXB9l7tpvaU&t=6', 'source': 'YouTube'}, {'title': 'Vasectomy Definition, Procedure & Effects - Lesson - Study.com', 'link': 'https://study.com/academy/lesson/vasectomy-purpose-advantages-disadvantages.html', 'source': 'Study.com'}]","[{'title': 'Vasectomy - Mayo Clinic', 'link': 'https://www.mayoclinic.org/tests-procedures/vasectomy/about/pac-20384580', 'source': 'Mayo Clinic'}, {'title': 'Vasectomy: Procedure, Side Effects, & Costs - Birth Control - WebMD', 'link': 'https://www.webmd.com/sex/birth-control/vasectomy-overview', 'source': 'WebMD'}, {'title': 'Vasectomy - Wikipedia', 'link': 'https://en.wikipedia.org/wiki/Vasectomy', 'source': 'Wikipedia'}, {'title': 'Vasectomy - NICHD - NIH', 'link': 'https://www.nichd.nih.gov/health/topics/vasectomy', 'source': 'National Institute of Child Health and Human Development (.gov)'}, {'title': 'Vasectomy Definition, Procedure & Effects - Lesson - Study.com', 'link': 'https://study.com/academy/lesson/vasectomy-purpose-advantages-disadvantages.html', 'source': 'Study.com'}, {'title': 'Vasectomy: MedlinePlus Medical Encyclopedia', 'link': 'https://medlineplus.gov/ency/article/002995.htm', 'source': 'MedlinePlus (.gov)'}, {'title': 'Everything You Need to Know About a Vasectomy', 'link': 'https://www.youtube.com/watch?t=6&v=WXB9l7tpvaU', 'source': 'YouTube'}, {'title': 'Everything You Need to Know About a Vasectomy', 'link': 'https://www.youtube.com/watch?v=WXB9l7tpvaU&t=6', 'source': 'YouTube'}]","['What happens to a man if he gets a vasectomy?', 'Can a man still come if he gets the snip?', 'Can I get pregnant when he has a vasectomy?', 'Is a vasectomy permanent?']"
Nigeria,tubal ligation pros and cons,True,"['Highly Effective: Over 99% effective, providing, according to the Cleveland Clinic, reliable, long-term contraception.', 'Permanent Solution: Ideal for individuals sure they do not want future pregnancies, eliminating the need for daily or temporary birth control.', 'Non-Hormonal: Does not affect your natural hormone levels, menstrual cycle, or mood.', 'Reduced Ovarian Cancer Risk: Studies suggest it may lower the risk of developing ovarian cancer, especially if the entire tube is removed.', 'Immediate Results: Protects against pregnancy immediately after the procedure.', 'Permanent/Hard to Reverse: Meant to be permanent, and reversal procedures are difficult, expensive, and not guaranteed to work.', 'No Protection Against STIs: Does not offer any protection against sexually transmitted infections (STIs).', 'Surgical Risks: As with any surgery, risks include bleeding, infection, and reaction to anesthesia, as noted by the NCCRM.', 'Regret: There is a possibility of regret later, particularly for women who undergo the procedure at a younger age.', 'Ectopic Pregnancy Risk: If a pregnancy occurs, it is more likely to be an ectopic pregnancy (outside the uterus), which is dangerous.', 'Alternative Options: Long-acting reversible contraceptives (LARCs) like IUDs or implants are actually more effective than tubal ligation and do not require surgery, explains Everyday Health.', 'Partnership Considerations: Vasectomies are often less invasive, more effective, and easier to reverse than tubal ligation.', 'Salpingectomy vs. Ligation: Complete removal of the tubes (salpingectomy) provides higher protection against ovarian cancer than just tying them (ligation).']","[{'title': 'Tubal Ligation: Procedure, Recovery & Side Effects - Cleveland Clinic', 'link': 'https://my.clevelandclinic.org/health/treatments/4933-tubal-ligation', 'source': 'Cleveland Clinic'}, {'title': 'Tubal Ligation: Understanding the Pros and Cons | Nurture Gynaecology', 'link': 'https://nurturegynaecology.com.au/tubal-ligation-understanding-the-pros-and-cons/', 'source': 'Nurture Gynaecology'}, {'title': 'Tubal Ligations: Advantages, Disadvantages & Recovery', 'link': 'https://www.tuasaude.com/en/tubal-ligation/', 'source': 'Tua Saúde'}, {'title': 'The Pros and Cons of Tubal Ligation - NCCRM', 'link': 'https://www.nccrm.com/tubal-ligation-reversal/the-pros-and-cons-of-tubal-ligation/', 'source': 'North Carolina Center for Reproductive Medicine'}, {'title': 'What does tubal ligation entail? The advantages and disadvantages of ...', 'link': 'https://www.institutobernabeu.com/en/blog/what-does-tubal-ligation-entail-the-advantages-and-disadvantages-of-this-method-of-birth-control/', 'source': 'Instituto Bernabeu'}, {'title': 'Tubal Ligation: Pros and Cons of Getting Your Tubes Tied - WebMD', 'link': 'https://www.webmd.com/sex/birth-control/tubal-ligation', 'source': 'WebMD'}, {'title': 'Tubal Ligation: Procedure, Recovery & Side Effects - Natural Cycles', 'link': 'https://www.naturalcycles.com/cyclematters/tubal-ligation', 'source': 'Natural Cycles'}, {'title': 'Tubal ligation - Mayo Clinic', 'link': 'https://www.mayoclinic.org/tests-procedures/tubal-ligation/about/pac-20388360', 'source': 'Mayo Clinic'}, {'title': 'Is Tubal Ligation Right for You? Pros, Cons, and Key Considerations', 'link': 'https://bshfw.com/is-tubal-ligation-right-for-you-pros-cons-and-key-considerations/', 'source': 'Baylor Scott & White Surgical Hospital Fort Worth'}, {'title': 'Tubal Ligation or Permanent Female Sterilization - Everyday Health', 'link': 'https://www.everydayhealth.com/womens-health/tubal-ligation-permanent-female-sterilization-misunderstood-birth-control-method/', 'source': 'Everyday Health'}]","[{'title': 'Tubal Ligation: Pros and Cons of Getting Your Tubes Tied - WebMD', 'link': 'https://www.webmd.com/sex/birth-control/tubal-ligation', 'source': 'WebMD'}, {'title': 'Tubal Ligation: Procedure, Recovery & Side Effects - Cleveland Clinic', 'link': 'https://my.clevelandclinic.org/health/treatments/4933-tubal-ligation', 'source': 'Cleveland Clinic'}, {'title': 'Tubal Ligation: Understanding the Pros and Cons | Nurture Gynaecology', 'link': 'https://nurturegynaecology.com.au/tubal-ligation-understanding-the-pros-and-cons/', 'source': 'Nurture Gynaecology'}, {'title': 'The Pros and Cons of Tubal Ligation - NCCRM', 'link': 'https://www.nccrm.com/tubal-ligation-reversal/the-pros-and-cons-of-tubal-ligation/', 'source': 'North Carolina Center for Reproductive Medicine'}, {'title': 'Tubal Ligation: Procedure, Recovery & Side Effects - Natural Cycles', 'link': 'https://www.naturalcycles.com/cyclematters/tubal-ligation', 'source': 'Natural Cycles'}, {'title': 'Tubal ligation - Mayo Clinic', 'link': 'https://www.mayoclinic.org/tests-procedures/tubal-ligation/about/pac-20388360', 'source': 'Mayo Clinic'}, {'title': 'Tubal Ligation or Permanent Female Sterilization - Everyday Health', 'link': 'https://www.everydayhealth.com/womens-health/tubal-ligation-permanent-female-sterilization-misunderstood-birth-control-method/', 'source': 'Everyday Health'}, {'title': 'What does tubal ligation entail? The advantages and disadvantages of ...', 'link': 'https://www.institutobernabeu.com/en/blog/what-does-tubal-ligation-entail-the-advantages-and-disadvantages-of-this-method-of-birth-control/', 'source': 'Instituto Bernabeu'}, {'title': 'Is Tubal Ligation Right for You? Pros, Cons, and Key Considerations', 'link': 'https://bshfw.com/is-tubal-ligation-right-for-you-pros-cons-and-key-considerations/', 'source': 'Baylor Scott & White Surgical Hospital Fort Worth'}, {'title': 'Tubal Ligations: Advantages, Disadvantages & Recovery', 'link': 'https://www.tuasaude.com/en/tubal-ligation/', 'source': 'Tua Saúde'}]","['What are the disadvantages of a tubal ligation?', 'What happens after 5 years of tubal ligation?', ""What's the best age to get your tubes tied?"", 'Is tubal ligation can still get pregnant?']"
Nigeria,abortion pill how does it work,True,"['Mifepristone: This first pill is usually taken at a clinic or at home. It blocks the hormone progesterone, which is necessary to maintain the pregnancy. Without progesterone, the uterine lining breaks down, and the pregnancy cannot continue.', 'Misoprostol: Taken 24 to 48 hours after the first pill, these tablets are taken orally or vaginally. They cause the uterus to contract and empty, causing cramping and bleeding, which expels the pregnancy tissue.', 'Process Duration: The process often takes several hours. Most people pass the pregnancy tissue within 4–5 hours of taking the second medicine, though it can take longer.', 'Symptoms: Intense cramping, heavy bleeding, and passing blood clots are expected. Other symptoms may include nausea, vomiting, diarrhea, fever, or chills.', 'Recovery: Bleeding and spotting may continue for several weeks, which is normal.', 'Follow-Up: A follow-up appointment or test is sometimes necessary to ensure the abortion is complete.', 'Effectiveness: The combined regimen is over 90% effective.', 'Misoprostol-Only: In some cases, only misoprostol is used (often 12 pills taken over several hours), which is also effective in ending early pregnancies.', 'Restriction: These medications are typically available by prescription and are highly restricted in some regions.']","[{'title': 'Medical Abortion: What It Is, Pain, Risks & Recovery - Cleveland Clinic', 'link': 'https://my.clevelandclinic.org/health/treatments/21899-medical-abortion', 'source': 'Cleveland Clinic'}, {'title': 'Types of abortion | NHS inform', 'link': 'https://www.nhsinform.scot/tests-and-treatments/non-surgical-procedures/abortion/types-of-abortion/', 'source': 'NHS inform'}, {'title': 'Medication Abortion: Your Questions Answered | News | Yale Medicine', 'link': 'https://www.yalemedicine.org/news/medication-abortion-your-questions-answered', 'source': 'Yale Medicine'}, {'title': 'How to take abortion pills: misoprostol & mifepristone', 'link': 'https://www.heyjane.com/articles/how-to-take-abortion-pills-what-to-expect', 'source': 'hey jane abortion pills'}, {'title': 'How Does the Abortion Pill Work: 1st Trimester Medical Abortion Video', 'link': 'https://www.youtube.com/watch?v=Tqe5JS14z3o&t=5', 'source': 'YouTube'}, {'title': 'Abortion Pill | Early Medical Abortion - NUPAS', 'link': 'https://www.nupas.co.uk/abortion-care/abortion-pill/', 'source': 'NUPAS'}, {'title': 'How Does the Abortion Pill Work? - Planned Parenthood', 'link': 'https://www.plannedparenthood.org/learn/abortion/the-abortion-pill/how-does-the-abortion-pill-work', 'source': 'Planned Parenthood'}, {'title': 'Taking Abortion Pills: What to Expect', 'link': 'https://www.abortionfinder.org/abortion-types/pill', 'source': 'Abortion Finder.org'}, {'title': 'How Do You Know If the Abortion Pill Worked? - Healthline', 'link': 'https://www.healthline.com/health/healthy-sex/how-do-you-know-if-the-abortion-pill-worked', 'source': 'Healthline'}, {'title': 'How Do Abortion Pills Work?', 'link': 'https://www.youtube.com/watch?v=ZfPSKEEOwuI', 'source': 'YouTube'}, {'title': 'How do I have an abortion using only misoprostol?', 'link': 'https://www.plannedparenthood.org/learn/abortion/the-abortion-pill/how-do-i-have-an-abortion-using-only-misoprostol', 'source': 'Planned Parenthood'}, {'title': 'Mifepristone (oral route) - Side effects & dosage - Mayo Clinic', 'link': 'https://www.mayoclinic.org/drugs-supplements/mifepristone-oral-route/description/drg-20067123', 'source': 'Mayo Clinic'}]","[{'title': 'How Does the Abortion Pill Work? - Planned Parenthood', 'link': 'https://www.plannedparenthood.org/learn/abortion/the-abortion-pill/how-does-the-abortion-pill-work', 'source': 'Planned Parenthood'}, {'title': 'Medical Abortion: What It Is, Pain, Risks & Recovery - Cleveland Clinic', 'link': 'https://my.clevelandclinic.org/health/treatments/21899-medical-abortion', 'source': 'Cleveland Clinic'}, {'title': 'Medication Abortion: Your Questions Answered | News | Yale Medicine', 'link': 'https://www.yalemedicine.org/news/medication-abortion-your-questions-answered', 'source': 'Yale Medicine'}, {'title': 'How Does the Abortion Pill Work: 1st Trimester Medical Abortion Video', 'link': 'https://www.youtube.com/watch?t=5&v=Tqe5JS14z3o', 'source': 'YouTube'}, {'title': 'How Do Abortion Pills Work?', 'link': 'https://www.youtube.com/watch?v=ZfPSKEEOwuI', 'source': 'YouTube'}, {'title': 'Abortion Pill | Early Medical Abortion - NUPAS', 'link': 'https://www.nupas.co.uk/abortion-care/abortion-pill/', 'source': 'NUPAS'}, {'title': 'How do I have an abortion using only misoprostol?', 'link': 'https://www.plannedparenthood.org/learn/abortion/the-abortion-pill/how-do-i-have-an-abortion-using-only-misoprostol', 'source': 'Planned Parenthood'}, {'title': 'Taking Abortion Pills: What to Expect', 'link': 'https://www.abortionfinder.org/abortion-types/pill', 'source': 'Abortion Finder.org'}, {'title': 'How Do You Know If the Abortion Pill Worked? - Healthline', 'link': 'https://www.healthline.com/health/healthy-sex/how-do-you-know-if-the-abortion-pill-worked', 'source': 'Healthline'}, {'title': 'Types of abortion | NHS inform', 'link': 'https://www.nhsinform.scot/tests-and-treatments/non-surgical-procedures/abortion/types-of-abortion/', 'source': 'NHS inform'}, {'title': 'Mifepristone (oral route) - Side effects & dosage - Mayo Clinic', 'link': 'https://www.mayoclinic.org/drugs-supplements/mifepristone-oral-route/description/drg-20067123', 'source': 'Mayo Clinic'}, {'title': 'How Does the Abortion Pill Work: 1st Trimester Medical Abortion Video', 'link': 'https://www.youtube.com/watch?v=Tqe5JS14z3o&t=5', 'source': 'YouTube'}, {'title': 'How to take abortion pills: misoprostol & mifepristone', 'link': 'https://www.heyjane.com/articles/how-to-take-abortion-pills-what-to-expect', 'source': 'hey jane abortion pills'}]","['How long does it take for the abortion pill to start working?', 'How does the baby come out after taking misoprostol?', 'What are the signs that the abortion pill has worked?', 'How long in the pregnancy can you take the abortion pill?']"
Nigeria,how far along can you get an abortion,True,[],[],[],"['How many weeks gone can you get an abortion?', 'Is it safe to abort at 20 weeks?', ""What if I am 2 months pregnant and I don't want the baby?"", 'What is the earliest you can get an abortion?']"
Nigeria,abortion pill side effects,True,"['Heavy Bleeding & Cramping: The most common side effects, with heaviest bleeding usually lasting 2-6 hours.', 'Gastrointestinal Issues: Nausea, vomiting, and diarrhea.', 'Flu-like Symptoms: Mild fever or chills, specifically on the day of taking misoprostol.', 'Dizziness & Fatigue: Light-headedness or tiredness.', 'Prolonged Bleeding: Light bleeding or spotting can continue for up to 4 weeks.', 'Bleeding that soaks through more than two maxi pads per hour for two consecutive hours.', 'Passing blood clots larger than a lemon for more than two hours.', 'Fever of $100.4^{\\circ}\\text{F}$ or higher after the day of taking misoprostol.', 'Severe abdominal pain that does not improve with pain medication.', 'Use pain relievers like ibuprofen (avoid aspirin as it can increase bleeding).', 'Use heating pads for cramping.', 'Rest and have sanitary pads available.']","[{'title': '9 Mifepristone and Misoprostol (Abortion Pill) Side Effects - GoodRx', 'link': 'https://www.goodrx.com/mifepristone/abortion-pill-side-effects', 'source': 'GoodRx'}, {'title': 'How Does the Abortion Pill Work? - Planned Parenthood', 'link': 'https://www.plannedparenthood.org/learn/abortion/the-abortion-pill/how-does-the-abortion-pill-work', 'source': 'Planned Parenthood'}, {'title': 'Abortion procedures - medication | Better Health Channel', 'link': 'https://www.betterhealth.vic.gov.au/health/healthyliving/abortion-procedures-medication', 'source': 'Better Health Channel'}, {'title': ""Side Effects of The Abortion Pill | Free Consultations - A Woman's Choice"", 'link': 'https://awomanschoice.com/abortion-pill-side-effects/', 'source': ""A Woman's Choice""}, {'title': 'What are the side effects of the abortion pills? - NUPAS', 'link': 'https://www.nupas.co.uk/faq/what-are-the-side-effects-of-the-abortion-pills/', 'source': 'NUPAS'}, {'title': 'What are the risks of taking abortion pills? - NUPAS', 'link': 'https://www.nupas.co.uk/faq/what-are-the-risks-of-taking-abortion-pills/', 'source': 'NUPAS'}, {'title': '8 Abortion Pill Side Effects & What You Need to Know', 'link': 'https://www.blueridgepc.org/8-abortion-pill-side-effects-and-what-you-need-to-know/', 'source': 'Blue Ridge Pregnancy Center'}, {'title': '5 Risks Associated with the Abortion Pill that You Should Know', 'link': 'https://palmbeachwc.org/5-risks-associated-with-the-abortion-pill-that-you-should-know/', 'source': ""Palm Beach Women's Clinic""}, {'title': 'Considering the Abortion Pill? Talk to us First | Cincinnati, OH', 'link': 'https://pcplus.org/considering-the-abortion-pill-talk-to-us-first/', 'source': 'Pregnancy Center Plus'}, {'title': 'Self-Managed Abortion: What to Expect After Taking Abortion Pills ...', 'link': 'https://www.youtube.com/watch?v=AyZgY7zbCBM', 'source': 'YouTube'}, {'title': 'FAQs about medication abortion', 'link': 'https://www.heyjane.com/faqs/medication-abortion', 'source': 'hey jane abortion pills'}, {'title': 'What Happens During an In-Clinic Abortion?', 'link': 'https://www.plannedparenthood.org/learn/abortion/in-clinic-abortion-procedures/what-happens-during-an-in-clinic-abortion', 'source': 'Planned Parenthood'}]","[{'title': '9 Mifepristone and Misoprostol (Abortion Pill) Side Effects - GoodRx', 'link': 'https://www.goodrx.com/mifepristone/abortion-pill-side-effects', 'source': 'GoodRx'}, {'title': 'How Does the Abortion Pill Work? - Planned Parenthood', 'link': 'https://www.plannedparenthood.org/learn/abortion/the-abortion-pill/how-does-the-abortion-pill-work', 'source': 'Planned Parenthood'}, {'title': 'Abortion procedures - medication | Better Health Channel', 'link': 'https://www.betterhealth.vic.gov.au/health/healthyliving/abortion-procedures-medication', 'source': 'Better Health Channel'}, {'title': '8 Abortion Pill Side Effects & What You Need to Know', 'link': 'https://www.blueridgepc.org/8-abortion-pill-side-effects-and-what-you-need-to-know/', 'source': 'Blue Ridge Pregnancy Center'}, {'title': 'What are the risks of taking abortion pills? - NUPAS', 'link': 'https://www.nupas.co.uk/faq/what-are-the-risks-of-taking-abortion-pills/', 'source': 'NUPAS'}, {'title': 'Self-Managed Abortion: What to Expect After Taking Abortion Pills ...', 'link': 'https://www.youtube.com/watch?v=AyZgY7zbCBM', 'source': 'YouTube'}, {'title': 'What are the side effects of the abortion pills? - NUPAS', 'link': 'https://www.nupas.co.uk/faq/what-are-the-side-effects-of-the-abortion-pills/', 'source': 'NUPAS'}, {'title': ""Side Effects of The Abortion Pill | Free Consultations - A Woman's Choice"", 'link': 'https://awomanschoice.com/abortion-pill-side-effects/', 'source': ""A Woman's Choice""}, {'title': '5 Risks Associated with the Abortion Pill that You Should Know', 'link': 'https://palmbeachwc.org/5-risks-associated-with-the-abortion-pill-that-you-should-know/', 'source': ""Palm Beach Women's Clinic""}, {'title': 'Considering the Abortion Pill? Talk to us First | Cincinnati, OH', 'link': 'https://pcplus.org/considering-the-abortion-pill-talk-to-us-first/', 'source': 'Pregnancy Center Plus'}, {'title': 'FAQs about medication abortion', 'link': 'https://www.heyjane.com/faqs/medication-abortion', 'source': 'hey jane abortion pills'}, {'title': 'What Happens During an In-Clinic Abortion?', 'link': 'https://www.plannedparenthood.org/learn/abortion/in-clinic-abortion-procedures/what-happens-during-an-in-clinic-abortion', 'source': 'Planned Parenthood'}]","['How many days of heavy bleeding after a medical abortion?', 'What are the complications of the abortion pill?', 'How long does bloating last after an abortion pill?', 'How long does it take to heal after an abortion?']"
Nigeria,surgical abortion procedure,True,[],[],[],"['Can you get a surgical abortion at 8 weeks?', 'Is a surgical abortion painful?', 'What is the recovery time for a surgical abortion?', 'What to expect with a surgical abortion?']"
Nigeria,abortion laws by state,True,[],[],[],"['How many states have banned abortion in the USA?', 'Can a 22 weeks pregnancy be aborted?', 'What state has the most strict abortion laws?', ""How many weeks until you can't terminate?""]"
Nigeria,abortion clinic near me,True,[],[],[],"['How much is the abortion fee in Nigeria?', 'How many weeks pregnant are you allowed to have an abortion?', 'What medicine to take for an early abortion?', 'Can a 22 weeks pregnancy be aborted?']"
Nigeria,how much does an abortion cost,True,[],[],[],"['What can I do to stop 2 weeks of pregnancy?', 'How much money is needed to abort?', 'Does the abortion pill work?', ""What to do if 1 month pregnant and don't want it?""]"
