location,query,has_ai_overview,all_items,cited_sources,all_references,paa_questions
Nigeria,early signs of pregnancy,True,"['Missed Period: The most common indicator, though stress or health factors can also cause delays.', 'Breast Changes: Tender, swollen, or tingling breasts, along with darkening of the areolas, often occur 2–3 days after conception.', 'Implantation Bleeding & Cramping: Light pink or brown spotting and mild cramping can occur 10–14 days after conception when the egg attaches to the uterus.', 'Fatigue: High levels of the hormone progesterone can make you feel extremely tired.', 'Nausea: Known as ""morning sickness,"" this can occur at any time of day, typically starting 2-8 weeks after conception.', 'Frequent Urination: Increased blood flow and hormonal changes cause the bladder to fill faster.', 'Heightened Sense of Smell and Taste: Many experience a metallic taste or new sensitivities to odors.']","[{'title': '18 Early Symptoms of Pregnancy: How to notice and confirm', 'link': 'https://www.medparkhospital.com/en-US/lifestyles/symptoms-of-pregnancy', 'source': 'MedPark Hospital'}, {'title': '10 Early Signs of Pregnancy | Johns Hopkins Medicine', 'link': 'https://www.hopkinsmedicine.org/health/wellness-and-prevention/10-early-signs-of-pregnancy', 'source': 'Johns Hopkins Medicine'}, {'title': 'Pregnancy Symptoms - NewYork-Presbyterian', 'link': 'https://www.nyp.org/womens/pregnancy-and-birth/symptoms', 'source': 'NewYork-Presbyterian'}, {'title': 'Am I Pregnant? Early Symptoms of Pregnancy & When To Test', 'link': 'https://my.clevelandclinic.org/health/articles/9709-pregnancy-am-i-pregnant', 'source': 'Cleveland Clinic'}, {'title': 'Early Pregnancy Symptoms - UPMC', 'link': 'https://www.upmc.com/services/womens-health/services/obgyn/obstetrics/pregnancy/journey/getting-pregnant/early-symptoms', 'source': 'UPMC'}, {'title': 'Early Signs of Pregnancy', 'link': 'https://americanpregnancy.org/getting-pregnant/early-signs-of-pregnancy/', 'source': 'American Pregnancy Association'}, {'title': 'What are some common signs of pregnancy? - NICHD', 'link': 'https://www.nichd.nih.gov/health/topics/pregnancy/conditioninfo/signs', 'source': 'National Institute of Child Health and Human Development (.gov)'}, {'title': 'Signs and symptoms of pregnancy - NHS', 'link': 'https://www.nhs.uk/pregnancy/trying-for-a-baby/signs-and-symptoms-of-pregnancy/', 'source': 'nhs.uk'}]","[{'title': '18 Early Symptoms of Pregnancy: How to notice and confirm', 'link': 'https://www.medparkhospital.com/en-US/lifestyles/symptoms-of-pregnancy', 'source': 'MedPark Hospital'}, {'title': 'Signs and symptoms of pregnancy - NHS', 'link': 'https://www.nhs.uk/pregnancy/trying-for-a-baby/signs-and-symptoms-of-pregnancy/', 'source': 'nhs.uk'}, {'title': '10 Early Signs of Pregnancy | Johns Hopkins Medicine', 'link': 'https://www.hopkinsmedicine.org/health/wellness-and-prevention/10-early-signs-of-pregnancy', 'source': 'Johns Hopkins Medicine'}, {'title': 'Am I Pregnant? Early Symptoms of Pregnancy & When To Test', 'link': 'https://my.clevelandclinic.org/health/articles/9709-pregnancy-am-i-pregnant', 'source': 'Cleveland Clinic'}, {'title': 'What are some common signs of pregnancy? - NICHD', 'link': 'https://www.nichd.nih.gov/health/topics/pregnancy/conditioninfo/signs', 'source': 'National Institute of Child Health and Human Development (.gov)'}, {'title': 'Pregnancy Symptoms - NewYork-Presbyterian', 'link': 'https://www.nyp.org/womens/pregnancy-and-birth/symptoms', 'source': 'NewYork-Presbyterian'}, {'title': 'Early Signs of Pregnancy', 'link': 'https://americanpregnancy.org/getting-pregnant/early-signs-of-pregnancy/', 'source': 'American Pregnancy Association'}, {'title': 'Early Pregnancy Symptoms - UPMC', 'link': 'https://www.upmc.com/services/womens-health/services/obgyn/obstetrics/pregnancy/journey/getting-pregnant/early-symptoms', 'source': 'UPMC'}]","['What are the first signs of pregnancy?', 'How do I know I am pregnant without a test?', 'What are 100% signs of pregnancy in the first week?', ""Can you feel if you're 1 week pregnant?""]"
Nigeria,what are the symptoms of pregnancy,True,"['Missed Period: Usually the most common sign, especially if your cycle is regular.', 'Tender/Swollen Breasts: Caused by hormonal changes, making breasts feel heavy or sensitive.', 'Fatigue: Intense tiredness is common, often due to higher levels of the hormone progesterone.', 'Nausea with or without Vomiting: Known as morning sickness, this can actually occur at any time of the day or night.', 'Frequent Urination: Increased blood flow and fluid cause the kidneys to process more waste.', 'Implantation Bleeding/Cramping: Light pink or brown spotting may occur when the embryo attaches to the uterus.', 'Darkening of the Areola: The area around the nipples may darken and become more sensitive.', 'Food Aversions or Cravings: Sudden disinterest in favorite foods or intense cravings.', 'Heightened Sense of Smell: Increased sensitivity to odors.', 'Bloating and Constipation: Increased hormones slow down the digestive system.', 'Mood Swings: Rapid emotional shifts.', 'Headaches or Backaches: Mild headaches or lower back pain can occur.']","[{'title': '18 Early Symptoms of Pregnancy: How to notice and confirm', 'link': 'https://www.medparkhospital.com/en-US/lifestyles/symptoms-of-pregnancy', 'source': 'MedPark Hospital'}, {'title': 'Pregnancy - signs and symptoms | Better Health Channel', 'link': 'https://www.betterhealth.vic.gov.au/health/healthyliving/pregnancy-signs-and-symptoms', 'source': 'Better Health Channel'}, {'title': 'Symptoms of pregnancy: What happens first - Mayo Clinic', 'link': 'https://www.mayoclinic.org/healthy-lifestyle/getting-pregnant/in-depth/symptoms-of-pregnancy/art-20043853', 'source': 'Mayo Clinic'}, {'title': '10 Early Signs of Pregnancy | Johns Hopkins Medicine', 'link': 'https://www.hopkinsmedicine.org/health/wellness-and-prevention/10-early-signs-of-pregnancy', 'source': 'Johns Hopkins Medicine'}, {'title': '12 Early Signs of Pregnancy - SSM Health', 'link': 'https://www.ssmhealth.com/newsroom/blogs/ssm-health-matters/april-2022/12-early-signs-of-pregnancy', 'source': 'SSM Health'}, {'title': 'Pregnancy Week By Week | First Month Symptoms and Signs', 'link': 'https://www.plannedparenthood.org/learn/pregnancy/pregnancy-month-by-month', 'source': 'Planned Parenthood'}, {'title': 'What are some common signs of pregnancy? - NICHD', 'link': 'https://www.nichd.nih.gov/health/topics/pregnancy/conditioninfo/signs', 'source': 'National Institute of Child Health and Human Development (.gov)'}, {'title': 'Early Pregnancy Signs in the Two Week Wait: Advice and Mistakes to ...', 'link': 'https://www.youtube.com/watch?v=KmnRyro-baM&t=167', 'source': 'YouTube'}, {'title': 'Signs and symptoms of pregnancy - NHS', 'link': 'https://www.nhs.uk/pregnancy/trying-for-a-baby/signs-and-symptoms-of-pregnancy/', 'source': 'nhs.uk'}, {'title': ""Introduction to Symptoms During Pregnancy - Women's Health"", 'link': 'https://www.msdmanuals.com/home/women-s-health-issues/symptoms-during-pregnancy/introduction-to-symptoms-during-pregnancy', 'source': 'MSD Manuals'}, {'title': ""Stages of pregnancy - Women's Health.gov"", 'link': 'https://womenshealth.gov/pregnancy/youre-pregnant-now-what/stages-pregnancy', 'source': ""Office on Women's Health (.gov)""}]","[{'title': '18 Early Symptoms of Pregnancy: How to notice and confirm', 'link': 'https://www.medparkhospital.com/en-US/lifestyles/symptoms-of-pregnancy', 'source': 'MedPark Hospital'}, {'title': 'Pregnancy - signs and symptoms | Better Health Channel', 'link': 'https://www.betterhealth.vic.gov.au/health/healthyliving/pregnancy-signs-and-symptoms', 'source': 'Better Health Channel'}, {'title': 'Signs and symptoms of pregnancy - NHS', 'link': 'https://www.nhs.uk/pregnancy/trying-for-a-baby/signs-and-symptoms-of-pregnancy/', 'source': 'nhs.uk'}, {'title': '10 Early Signs of Pregnancy | Johns Hopkins Medicine', 'link': 'https://www.hopkinsmedicine.org/health/wellness-and-prevention/10-early-signs-of-pregnancy', 'source': 'Johns Hopkins Medicine'}, {'title': 'Symptoms of pregnancy: What happens first - Mayo Clinic', 'link': 'https://www.mayoclinic.org/healthy-lifestyle/getting-pregnant/in-depth/symptoms-of-pregnancy/art-20043853', 'source': 'Mayo Clinic'}, {'title': 'What are some common signs of pregnancy? - NICHD', 'link': 'https://www.nichd.nih.gov/health/topics/pregnancy/conditioninfo/signs', 'source': 'National Institute of Child Health and Human Development (.gov)'}, {'title': 'Pregnancy Week By Week | First Month Symptoms and Signs', 'link': 'https://www.plannedparenthood.org/learn/pregnancy/pregnancy-month-by-month', 'source': 'Planned Parenthood'}, {'title': ""Stages of pregnancy - Women's Health.gov"", 'link': 'https://womenshealth.gov/pregnancy/youre-pregnant-now-what/stages-pregnancy', 'source': ""Office on Women's Health (.gov)""}, {'title': ""Introduction to Symptoms During Pregnancy - Women's Health"", 'link': 'https://www.msdmanuals.com/home/women-s-health-issues/symptoms-during-pregnancy/introduction-to-symptoms-during-pregnancy', 'source': 'MSD Manuals'}, {'title': 'Early Pregnancy Signs in the Two Week Wait: Advice and Mistakes to ...', 'link': 'https://www.youtube.com/watch?t=167&v=KmnRyro-baM', 'source': 'YouTube'}, {'title': '12 Early Signs of Pregnancy - SSM Health', 'link': 'https://www.ssmhealth.com/newsroom/blogs/ssm-health-matters/april-2022/12-early-signs-of-pregnancy', 'source': 'SSM Health'}, {'title': 'Early Pregnancy Signs in the Two Week Wait: Advice and Mistakes to ...', 'link': 'https://www.youtube.com/watch?v=KmnRyro-baM&t=167', 'source': 'YouTube'}]","['How do I know I am pregnant without a test?', 'What are the 10 signs of pregnancy?', 'Where do you touch to feel if you are pregnant?', ""How can I tell if I'm pregnant after 1 week?""]"
Nigeria,how early can you take a pregnancy test,True,"['Best Time: The day after your missed period.', 'Earliest Possible: 6 days before your missed period (using early detection tests).', ""If You Don't Know Your Cycle: Take the test at least 21 days after unprotected sex."", 'Best Time of Day: Use your first morning urine, as it is most concentrated.']","[{'title': 'Calculate When to Take a Pregnancy Test - Clearblue', 'link': 'https://uk.clearblue.com/pregnancy-tests/early-pregnancy-testing', 'source': 'uk.clearblue.com'}, {'title': 'Am I Pregnant? Early Symptoms of Pregnancy & When To Test', 'link': 'https://my.clevelandclinic.org/health/articles/9709-pregnancy-am-i-pregnant', 'source': 'Cleveland Clinic'}, {'title': 'How early can home pregnancy tests show positive results?', 'link': 'https://utswmed.org/medblog/home-pregnancy-tests/', 'source': 'utswmed.org'}, {'title': 'How Soon Can You Take a Pregnancy Test, and What Comes Next?', 'link': 'https://www.essentiahealth.org/about/essentia-health-newsroom/obgyn-how-soon-can-you-take-a-pregnancy-test-and-what-comes-next', 'source': 'Essentia Health'}, {'title': 'Doing a pregnancy test - NHS', 'link': 'https://www.nhs.uk/pregnancy/trying-for-a-baby/doing-a-pregnancy-test/', 'source': 'nhs.uk'}, {'title': 'Pregnancy Test: When To Take, Types & Accuracy - Cleveland Clinic', 'link': 'https://my.clevelandclinic.org/health/diagnostics/9703-pregnancy-tests', 'source': 'Cleveland Clinic'}, {'title': 'How Early Can You Use a Pregnacy Test? Doctor Explains Sources ...', 'link': 'https://www.instagram.com/reel/DXAMyMzMDCO/', 'source': 'Instagram'}, {'title': 'When Can I Take a Pregnancy Test - Clearblue', 'link': 'https://ca-en.clearblue.com/pregnancy-tests/early-pregnancy-testing', 'source': 'ca-en.clearblue.com'}, {'title': 'When to take a pregnancy test for more accurate results - Flo app', 'link': 'https://flo.health/getting-pregnant/trying-to-conceive/pregnancy-tests/when-to-take-a-pregnancy-test', 'source': 'Flo.health'}]","[{'title': 'Doing a pregnancy test - NHS', 'link': 'https://www.nhs.uk/pregnancy/trying-for-a-baby/doing-a-pregnancy-test/', 'source': 'nhs.uk'}, {'title': 'Pregnancy Test: When To Take, Types & Accuracy - Cleveland Clinic', 'link': 'https://my.clevelandclinic.org/health/diagnostics/9703-pregnancy-tests', 'source': 'Cleveland Clinic'}, {'title': 'Calculate When to Take a Pregnancy Test - Clearblue', 'link': 'https://uk.clearblue.com/pregnancy-tests/early-pregnancy-testing', 'source': 'uk.clearblue.com'}, {'title': 'Am I Pregnant? Early Symptoms of Pregnancy & When To Test', 'link': 'https://my.clevelandclinic.org/health/articles/9709-pregnancy-am-i-pregnant', 'source': 'Cleveland Clinic'}, {'title': 'When to take a pregnancy test for more accurate results - Flo app', 'link': 'https://flo.health/getting-pregnant/trying-to-conceive/pregnancy-tests/when-to-take-a-pregnancy-test', 'source': 'Flo.health'}, {'title': 'When Can I Take a Pregnancy Test - Clearblue', 'link': 'https://ca-en.clearblue.com/pregnancy-tests/early-pregnancy-testing', 'source': 'ca-en.clearblue.com'}, {'title': 'How early can home pregnancy tests show positive results?', 'link': 'https://utswmed.org/medblog/home-pregnancy-tests/', 'source': 'utswmed.org'}, {'title': 'How Soon Can You Take a Pregnancy Test, and What Comes Next?', 'link': 'https://www.essentiahealth.org/about/essentia-health-newsroom/obgyn-how-soon-can-you-take-a-pregnancy-test-and-what-comes-next', 'source': 'Essentia Health'}, {'title': 'How Early Can You Use a Pregnacy Test? Doctor Explains Sources ...', 'link': 'https://www.instagram.com/reel/DXAMyMzMDCO/', 'source': 'Instagram'}]","['What is the earliest a pregnancy test will show up?', 'How many weeks pregnant do you have to be for the test to say positive?', 'Can I confirm pregnancy after 3 days?', 'Can you confirm pregnancy at 1 week?']"
Nigeria,symptoms of ectopic pregnancy,True,"['Abnormal Vaginal Bleeding: Often starts and stops, and may be lighter, heavier, or darker brown than a normal period.', 'Pelvic/Abdominal Pain: Pain in the lower stomach, often on one side, which may come on suddenly or gradually.', 'Shoulder Pain: A unique symptom caused by blood from a ruptured fallopian tube irritating specific nerves.', 'Dizziness or Fainting: Symptoms of potential severe internal bleeding and shock.', 'Rectal Pressure/Bowel Issues: Pain when passing stool or, in some cases, diarrhea.', 'A missed period.', 'Breast tenderness.', 'Nausea.', 'A positive pregnancy test.']","[{'title': 'Ectopic pregnancy - Symptoms & causes - Mayo Clinic', 'link': 'https://www.mayoclinic.org/diseases-conditions/ectopic-pregnancy/symptoms-causes/syc-20372088', 'source': 'Mayo Clinic'}, {'title': 'Ectopic pregnancy - Symptoms - NHS', 'link': 'https://www.nhs.uk/conditions/ectopic-pregnancy/symptoms/', 'source': 'nhs.uk'}, {'title': 'Symptoms of ectopic pregnancy - Centro Médico ABC', 'link': 'https://centromedicoabc.com/en/digital-magazine/symptoms-of-ectopic-pregnancy/', 'source': 'Centro Médico ABC'}, {'title': ""Ectopic Pregnancy - Women's Health - MSD Manuals"", 'link': 'https://www.msdmanuals.com/home/women-s-health-issues/early-pregnancy-disorders/ectopic-pregnancy', 'source': 'MSD Manuals'}, {'title': 'Ectopic pregnancy | NHS inform', 'link': 'https://www.nhsinform.scot/illnesses-and-conditions/pregnancy-and-childbirth/losing-a-baby/ectopic-pregnancy/', 'source': 'NHS inform'}, {'title': 'Ectopic Pregnancy: Causes, Symptoms & Treatments', 'link': 'https://my.clevelandclinic.org/health/diseases/9687-ectopic-pregnancy', 'source': 'Cleveland Clinic'}, {'title': 'Symptom of Ectopic Pregnancy | What are the Signs and Symptoms of ...', 'link': 'https://www.youtube.com/watch?v=N_u21Xnaa68&t=3', 'source': 'YouTube'}, {'title': ""Ectopic Pregnancy: Symptoms, Treatment and Support - Tommy's"", 'link': 'https://www.tommys.org/baby-loss-support/ectopic-pregnancy-information-support', 'source': ""Tommy's | The pregnancy and baby charity""}, {'title': 'Ectopic Pregnancy | Nemours KidsHealth', 'link': 'https://kidshealth.org/en/parents/ectopic.html', 'source': 'KidsHealth'}]","[{'title': 'Ectopic pregnancy - Symptoms & causes - Mayo Clinic', 'link': 'https://www.mayoclinic.org/diseases-conditions/ectopic-pregnancy/symptoms-causes/syc-20372088', 'source': 'Mayo Clinic'}, {'title': 'Ectopic pregnancy - Symptoms - NHS', 'link': 'https://www.nhs.uk/conditions/ectopic-pregnancy/symptoms/', 'source': 'nhs.uk'}, {'title': 'Ectopic Pregnancy: Causes, Symptoms & Treatments', 'link': 'https://my.clevelandclinic.org/health/diseases/9687-ectopic-pregnancy', 'source': 'Cleveland Clinic'}, {'title': 'Ectopic pregnancy | NHS inform', 'link': 'https://www.nhsinform.scot/illnesses-and-conditions/pregnancy-and-childbirth/losing-a-baby/ectopic-pregnancy/', 'source': 'NHS inform'}, {'title': ""Ectopic Pregnancy: Symptoms, Treatment and Support - Tommy's"", 'link': 'https://www.tommys.org/baby-loss-support/ectopic-pregnancy-information-support', 'source': ""Tommy's | The pregnancy and baby charity""}, {'title': ""Ectopic Pregnancy - Women's Health - MSD Manuals"", 'link': 'https://www.msdmanuals.com/home/women-s-health-issues/early-pregnancy-disorders/ectopic-pregnancy', 'source': 'MSD Manuals'}, {'title': 'Symptoms of ectopic pregnancy - Centro Médico ABC', 'link': 'https://centromedicoabc.com/en/digital-magazine/symptoms-of-ectopic-pregnancy/', 'source': 'Centro Médico ABC'}, {'title': 'Symptom of Ectopic Pregnancy | What are the Signs and Symptoms of ...', 'link': 'https://www.youtube.com/watch?t=3&v=N_u21Xnaa68', 'source': 'YouTube'}, {'title': 'Symptom of Ectopic Pregnancy | What are the Signs and Symptoms of ...', 'link': 'https://www.youtube.com/watch?v=N_u21Xnaa68&t=3', 'source': 'YouTube'}, {'title': 'Ectopic Pregnancy | Nemours KidsHealth', 'link': 'https://kidshealth.org/en/parents/ectopic.html', 'source': 'KidsHealth'}]","['What are three signs of an ectopic pregnancy?', 'Where does ectopic pregnancy hurt?', 'How to detect ectopic pregnancy early?', 'Can you have ectopic pregnancy symptoms without bleeding?']"
Nigeria,what are the signs of a miscarriage,True,"['Vaginal Bleeding: This is the most common sign, which may start as light brown, coffee-ground-like spotting before becoming heavy, bright red bleeding.', 'Abdominal/Pelvic Cramping: Painful cramps in the lower abdomen that may be dull, sharp, or persistent.', 'Back Pain: Pain in the lower back that can range from mild to severe.', 'Passing Tissue: Passing greyish or clot-like tissue through the vagina.', 'Decreased Pregnancy Symptoms: A sudden disappearance or reduction in pregnancy signs like breast tenderness or nausea.', 'Fluid Discharge: A sudden gush of clear or pink fluid.', 'Not All Bleeding Means Miscarriage: Vaginal bleeding is common in the first trimester, particularly around week 12, and does not always indicate a pregnancy loss.', 'Missed Miscarriage: Sometimes, a miscarriage occurs without any symptoms (known as a ""missed miscarriage"" or ""silent miscarriage""), and is only discovered during a routine scan.', 'Evaluation Needed: Even if you think you have passed the entire pregnancy, you should be evaluated by a healthcare professional.']","[{'title': 'Miscarriage: Causes, Symptoms, Risks, Treatment & Prevention', 'link': 'https://my.clevelandclinic.org/health/diseases/9688-miscarriage', 'source': 'Cleveland Clinic'}, {'title': 'Miscarriage - Johns Hopkins Medicine', 'link': 'https://www.hopkinsmedicine.org/health/conditions-and-diseases/miscarriage', 'source': 'Johns Hopkins Medicine'}, {'title': 'What are the signs of early miscarriage? - UC Davis Health', 'link': 'https://health.ucdavis.edu/obgyn/specialties/family-planning/early-pregnancy-miscarriage/signs-early-miscarriage', 'source': 'University of California - Davis Health'}, {'title': ""Miscarriage - Women's Health - MSD Manual Consumer Version"", 'link': 'https://www.msdmanuals.com/home/women-s-health-issues/early-pregnancy-disorders/miscarriage', 'source': 'MSD Manuals'}, {'title': 'Miscarriage: MedlinePlus Medical Encyclopedia', 'link': 'https://medlineplus.gov/ency/article/001488.htm', 'source': 'MedlinePlus (.gov)'}, {'title': 'Miscarriage - Symptoms and causes - Mayo Clinic', 'link': 'https://www.mayoclinic.org/diseases-conditions/pregnancy-loss-miscarriage/symptoms-causes/syc-20354298', 'source': 'Mayo Clinic'}, {'title': 'Missed (Silent) Miscarriage: Definition, Signs & Symptoms', 'link': 'https://www.tommys.org/baby-loss-support/miscarriage-information-and-support/types-of-miscarriage/missed-miscarriage-information-and-support', 'source': ""Tommy's | The pregnancy and baby charity""}, {'title': 'Signs and symptoms of a miscarriage | Ohio State Medical Center', 'link': 'https://www.youtube.com/shorts/B_79G5wXG9U', 'source': 'YouTube'}]","[{'title': 'Miscarriage: Causes, Symptoms, Risks, Treatment & Prevention', 'link': 'https://my.clevelandclinic.org/health/diseases/9688-miscarriage', 'source': 'Cleveland Clinic'}, {'title': 'Miscarriage - Symptoms and causes - Mayo Clinic', 'link': 'https://www.mayoclinic.org/diseases-conditions/pregnancy-loss-miscarriage/symptoms-causes/syc-20354298', 'source': 'Mayo Clinic'}, {'title': 'What are the signs of early miscarriage? - UC Davis Health', 'link': 'https://health.ucdavis.edu/obgyn/specialties/family-planning/early-pregnancy-miscarriage/signs-early-miscarriage', 'source': 'University of California - Davis Health'}, {'title': 'Miscarriage - Johns Hopkins Medicine', 'link': 'https://www.hopkinsmedicine.org/health/conditions-and-diseases/miscarriage', 'source': 'Johns Hopkins Medicine'}, {'title': 'Miscarriage: MedlinePlus Medical Encyclopedia', 'link': 'https://medlineplus.gov/ency/article/001488.htm', 'source': 'MedlinePlus (.gov)'}, {'title': 'Missed (Silent) Miscarriage: Definition, Signs & Symptoms', 'link': 'https://www.tommys.org/baby-loss-support/miscarriage-information-and-support/types-of-miscarriage/missed-miscarriage-information-and-support', 'source': ""Tommy's | The pregnancy and baby charity""}, {'title': ""Miscarriage - Women's Health - MSD Manual Consumer Version"", 'link': 'https://www.msdmanuals.com/home/women-s-health-issues/early-pregnancy-disorders/miscarriage', 'source': 'MSD Manuals'}, {'title': 'Signs and symptoms of a miscarriage | Ohio State Medical Center', 'link': 'https://www.youtube.com/shorts/B_79G5wXG9U', 'source': 'YouTube'}]","['How do you know if a miscarriage has started?', 'What are silent miscarriage symptoms?', 'How many pregnancies end in miscarriage?', 'What happens to your body after a miscarriage?']"
